title,summary,free,genre,installs,ratings,price,size,contentRating,reviews,released,adSupported,sale,score,similarApps,version
ArikAir Lite,Book flights to & from Nigeria & West Africa with West-Africa's leading airline,True,Travel & Local,"1,000+",30.0,0.0,7.5M,Rated for 3+,9.0,"Dec 30, 2019",True,False,4.5666666,"['com.airazman.android', 'com.wakanow.android', 'com.hititcs.arikair', 'com.amadeus.mercimdp.wb', 'com.amadeus.merci.kq']",1.0
Parizzo Passenger - Carpool,Carpooling/Ridesharing App in Lagos | A safer and cheaper commute option.,True,Travel & Local,"1,000+",22.0,0.0,39M,Rated for 12+,16.0,"Nov 10, 2017",,False,4.2727275,"['ai.bliq.ride', 'com.hitchplanet.android', 'com.taxicaller.app', 'com.gettransfer', 'com.itsmyride.passenger']",2.031
Bookings Nigeria,"The Bookings Nigeria app helps you search, compare and book discounted flights.",True,Travel & Local,"1,000+",6.0,0.0,50M,Rated for 3+,5.0,"Dec 31, 2017",,False,4.5,"['com.microsoft.exchange.bookings', 'au.com.webjet', 'com.virginvoyages.sailorapp', 'com.airlinetickets.hotels', 'com.flightconnections']",4
Lagos Map and Walks,A handy app with several self-guided walks to see the best of Lagos.,True,Travel & Local,"1,000+",13.0,0.0,55M,Rated for 3+,2.0,"Jul 5, 2013",True,False,4.3076925,"['org.missingmaps.mapswipe', 'com.swash.transitworld.dubai', 'com.js.guide.nyc', 'com.gpsmycity.iwtmaster', 'com.mapfactor.navigator_pro_truck']",53
MAX Champion (Rider),The app for MAX Champions (The Rider App).,True,Maps & Navigation,"1,000+",119.0,0.0,15M,Rated for 3+,57.0,"Mar 10, 2017",,False,4.3,"['io.iotex.iopay.gp', 'com.jetlab.rotaxevojetting', 'com.emulator.fpse64', 'io.recompiled.redream', 'com.isenet.kartchassissetup']",3.4.6
"RoiTaxi Africa: Taxi in Kinshasa, Kaduna, Kano","Keke (tricycle) okada (bike) and Taxi, all in a affordable and reliable service",True,Travel & Local,"1,000+",27.0,0.0,31M,Rated for 3+,19.0,"Apr 24, 2019",,False,4.296296,"['com.app.congoactualite', 'com.senenews', 'com.africanews.android', 'com.nextwebart.senego', 'com.guinee.actualites']",0.32.04-BOOM
Timbu USSD Helper - Airtime and Banking Using USSD,Do transactions without dialing USSD Codes,True,Travel & Local,"1,000+",14.0,0.0,8.7M,Rated for 3+,5.0,"Jan 21, 2020",,False,4.642857,"['io.eclectics.sbu.flexipay', 'com.absa.ug.mobile.android.ui', 'com.app.ezeepay', 'com.paywaytalk', 'tingtel.android']",1.0.5
Nigeria Train Guide - NTG,Generic Train schedule.,True,Travel & Local,"5,000+",57.0,0.0,4.2M,Rated for 3+,24.0,"May 19, 2017",True,False,4.0701756,"['com.siddigital_.nrc', 'com.airazman.android', 'net.cheapflightsonline', 'com.wakanow.android', 'com.hititcs.arikair']",13.0
Shuttlers,Shuttlers allow professionals access an efficient scheduled ride-sharing service,True,Maps & Navigation,"5,000+",183.0,0.0,34M,Rated for 3+,126.0,"Nov 2, 2017",,False,4.25,"['com.rj.jobsicle', 'com.fatattitude.tripchecker', 'com.itfglobal.news', 'com.geometricglobal.glovius', 'com.pragmaproducts.workmanager']",2.0.38
Shuttlers Driver,Shuttlers allow professionals access an efficient scheduled ride-sharing service,True,Maps & Navigation,500+,18.0,0.0,67M,Rated for 3+,10.0,"Nov 5, 2017",,False,4.888889,"['via.viavan.driver', 'com.facedrive', 'dk.commuteapp.app', 'ai.bliq.ride', 'com.taxiye.driver']",5.2.7
Hotels In Nigeria,"Hotels in Nigeria, a directory of hotels in Nigeria's towns and cities",True,Travel & Local,"1,000+",6.0,0.0,14M,Rated for 3+,1.0,"Sep 22, 2013",True,False,3.5,"['moneymie.bank.nigeria.remit.sendmoney', 'co.tradedepot.shop', 'com.nipek.cdcare', 'com.ifs.banking.fiid3605', 'com.cowry']",1.191
Tokeeto,We are YOUR SMARTEST WAY TO MOVE from one city to another. Book a trip today!,True,Travel & Local,"1,000+",21.0,0.0,6.9M,Rated for 3+,17.0,"Nov 21, 2019",,False,3.2380953,"['com.GoCarDev', 'com.plentywaka.rider.app', 'es.com.yellow.taxi.barcelona.pasajero', 'com.facedrive', 'com.airazman.android']",0.1.0-beta09
"BookMyTrip - Stays, Activities & Transportation","Book your Stays, Activities & Transportation on the go!",True,Travel & Local,"1,000+",7.0,0.0,3.7M,Rated for 3+,5.0,"Jan 17, 2018",,False,3.2857144,"['com.hotellook', 'com.wego.android', 'com.hotelbooking.cheaphotels', 'com.dreamstep.holidayd.hoteldeals', 'com.cheaphotels.extendedstay']",1.2.0
Tuchi,Tuchi Makes Transportation easy for people living in lagos,True,Travel & Local,"1,000+",16.0,0.0,16M,Rated for 3+,14.0,"Feb 22, 2019",,False,2.3125,"['moneymie.bank.nigeria.remit.sendmoney', 'com.cowry', 'com.aella.comportal', 'ng.bytelabs.watu', 'com.callphoneng.airvend']",1.13.7
RideOn.NG - Taxi Hailing App,RideOn is a taxi hailing app to just tap to request a ride safely and pay easily,True,Maps & Navigation,"1,000+",47.0,0.0,7.8M,Rated for 3+,42.0,"Jul 7, 2018",,False,3.9574468,"['com.heetch', 'com.taxime.client', 'com.craftsilicon.littlecabdriver', 'com.taxicaller.app', 'com.safeboda.driver']",2.1.4.0
RideOn.NG Drivers,RideOn is a taxi hailing app to just tap to request a ride safely and pay easily,True,Maps & Navigation,500+,12.0,0.0,9.0M,Rated for 3+,8.0,"Jul 7, 2018",,False,4.4166665,"['com.taxicaller.app', 'com.taxif.driver', 'io.viggo.rider', 'com.taxime.client', 'com.taxicaller.dispatch']",2.1.3.0
Zkyte,"Zkyte is a ridesharing application for quick, dependable rides in minutes...",True,Travel & Local,500+,14.0,0.0,15M,Rated for 3+,13.0,"Sep 28, 2018",,False,5.0,"['com.dtc.dtccustomer', 'com.picndrop.Driver', 'com.karwatechnologies.karwataxi', 'ai.bliq.ride', 'dk.commuteapp.app']",1.3
GLT Nigeria Driver app,Greenlight driver application.,True,Travel & Local,500+,8.0,0.0,12M,Rated for 3+,3.0,"Oct 7, 2017",,False,5.0,"['com.craftsilicon.littlecabdriver', 'com.facedrive', 'via.viavan.driver', 'com.taxiye.driver', 'com.robytechnologies.roby']",1.5
Monochrome - The Transport App,Quick & Affordable rides,True,Travel & Local,500+,5.0,0.0,17M,Rated for 3+,3.0,"Oct 29, 2017",,False,4.6,"['com.facedrive', 'dk.commuteapp.app', 'com.gettransfer', 'com.safeboda.driver', 'ai.bliq.ride']",1.3.8
Gomywayride,Our mission is simple to fill empty seats in car and help people travel together,True,Travel & Local,500+,9.0,0.0,10M,Rated for 3+,7.0,"Dec 19, 2019",,False,4.222222299999999,"['com.driiveme.driivemeapp', 'com.facedrive', 'com.gigm', 'com.mydriver.customer', 'com.hitchplanet.android']",1.4
Sheeft Driver,Sheeft Ride sharing application,True,Maps & Navigation,500+,30.0,0.0,19M,Rated for 3+,13.0,"Jul 8, 2019",,False,4.0,"['com.aella.comportal', 'com.wemabank.alat.prod', 'com.transsnetfinancial.palmcredit', 'com.univasa.provider', 'com.cowry']",2.3.1
PharmaMap,Register your  pharmacy with ACPN  Lagos Nigeria.,True,Maps & Navigation,500+,8.0,0.0,6.0M,Rated for 3+,3.0,"May 19, 2017",,False,3.625,"['com.nipek.cdcare', 'moneymie.bank.nigeria.remit.sendmoney', 'com.aella.comportal', 'com.kongapay.android', 'com.ifs.banking.fiid3605']",1.5
World Water Bodies Travel & Explore Guide,"Have a look at seas, reefs, rivers, lakes, waterfalls and other water bodies.",True,Travel & Local,500+,,0.0,8.5M,Rated for 3+,0.0,"Mar 30, 2017",True,False,0.0,"['com.jimbl.campchecklist', 'nz.co.campermate', 'com.rvadventuretreks.rvchecklist', 'com.justinguitar.timetrainer', 'org.motorhomeparking.map']",1.0.6
Transcorp Hilton Abuja,"Transcorp Hilton Abuja, Nigeria's leading hotel, boasts 670 luxurious rooms.",True,Travel & Local,500+,,0.0,20M,Rated for 3+,0.0,"Apr 10, 2015",,False,0.0,"['net.pruvo.mobile', 'com.ihg.apps.android', 'com.domibay.ebooking', 'com.Hyatt.hyt', 'com.ratesndeals.cheap.hotels']",4.20.3-37
JustFly.ng - Booking Portal for All Local Flights.,Justfly.ng - Nigeria's Premiere Booking Portal for All Local & Regional Airlines,True,Travel & Local,500+,5.0,0.0,15M,Rated for 3+,3.0,"Sep 25, 2018",,False,5.0,"['com.cleartrip.android', 'com.tajawal', 'com.ratesndeals.cheapflights', 'com.akbartravel.AkbarTravels', 'com.lastminuteflights.hotels']",1.0
Maiduguri - Wiki,Maiduguri Utility App,True,Travel & Local,"1,000+",,0.0,6.9M,Rated for 3+,0.0,"Aug 23, 2018",True,False,0.0,['com.amadeus.mercimdp.wb'],1.0.10
Skydrive Taxi,Skydrive that connects a passenger to a driver for ease of transportation.,True,Travel & Local,100+,7.0,0.0,11M,Rated for 3+,6.0,"Sep 24, 2019",,False,5.0,"['com.yeiksof.droidcar', 'com.meemim.vgis', 'com.wifianalyzer.networktools.wifitest.pro', 'to.hopin.android', 'com.ubtsupport.streamline3admin']",1.2
Letsgo Nigeria,An Afrotourism app that allows you to explore fascinating places in Nigeria.,True,Travel & Local,500+,41.0,0.0,18M,Rated for 3+,35.0,"Feb 20, 2019",True,False,4.8292685,"['com.kongapay.android', 'com.anhong.SkyCargoLtd', 'com.hititcs.arikair', 'com.suregifts.sureremit', 'com.simbapay.simbapayandroid']",2.13
eHara,The All-New eHara Passenger app for ride-hailing,True,Maps & Navigation,500+,7.0,0.0,8.4M,Rated for 3+,5.0,"Jul 22, 2019",,False,4.285714,"['com.zaotec.hirefare', 'com.karwatechnologies.karwataxi', 'net.kakiflower.ubereatsmap', 'production.rydedrive.driver', 'com.taxicaller.app']",2.0
Mytrip.ng - Bus Booking in Nigeria,#1 Online bus booking solution for real time bus ticket reservations in Nigeria,True,Travel & Local,500+,27.0,0.0,16M,Rated for 3+,26.0,"Aug 12, 2020",,False,4.5185184000000005,"['com.gigm', 'com.wakanow.android', 'com.airazman.android', 'co.tradedepot.shop', 'com.cowry']",1.3.0
OHstel,OHstel is the biggest student marketplace,True,Travel & Local,100+,30.0,0.0,39M,Rated for 3+,24.0,"Feb 25, 2020",True,False,4.766667,"['com.ifs.banking.fiid7416', 'moneymie.bank.nigeria.remit.sendmoney', 'ng.bytelabs.watu', 'com.afriex.afriex', 'com.suregifts.sureremit']",5.0
RoadRacers Driver,"We specialize in Airport Transfers, Private taxi service.",True,Travel & Local,100+,6.0,0.0,6.1M,Rated for 3+,4.0,"May 9, 2018",True,False,4.6666665,"['com.gigm', 'com.wakanow.android', 'com.taamcab.catchuser', 'com.anhong.SkyCargoLtd', 'com.taxicaller.app']",7.0.0
Amba,"Fast and Reliable First Response Care and Transport at home, work and at play.",True,Travel & Local,100+,11.0,0.0,13M,Rated for 3+,8.0,"Aug 9, 2018",,False,4.6363635,,1.2.9
"NAIRAXI- Ride, Shop, Delivery","A hybrid app that offers mobility, e-Commerce and Logistics services.",True,Travel & Local,"1,000+",56.0,0.0,18M,Rated for 3+,43.0,"Oct 8, 2020",,False,4.482143,"['com.sherpas.takeoutfood', 'ai.bliq.ride', 'com.kwik.messenger', 'com.shipox.driver', 'com.ideatolife.foodak2020']",4.6.7
Tripp Platform Services,Innovative app platform for everyday services.,True,Travel & Local,100+,17.0,0.0,33M,Rated for 3+,8.0,"Feb 9, 2019",,False,4.529412000000001,"['com.swapfiets', 'com.driiveme.driivemeapp', 'com.webtrain.examtestingengine', 'com.workaway.app', 'com.flexwrapp.app']",2.0.10
MyCityRide,Keke and Taxi Hailing App,True,Maps & Navigation,100+,5.0,0.0,8.5M,Rated for 3+,2.0,"Apr 2, 2018",,False,4.4,"['carngo.app', 'com.appsmas.estimaterate', 'com.gettransfer', 'com.carsscanner', 'net.jerryhuang.WeTheDrivers']",0.7.10
RideOn.NG Drivers,RideOn is a taxi hailing app to just tap to request a ride safely and pay easily,True,Maps & Navigation,500+,12.0,0.0,9.0M,Rated for 3+,8.0,"Jul 7, 2018",,False,4.4166665,"['com.taxicaller.app', 'com.taxif.driver', 'io.viggo.rider', 'com.taxime.client', 'com.taxicaller.dispatch']",2.1.3.0
Inaaga User,Inaaga takes away the disappointment and stress in hailing a taxi or keke.,True,Travel & Local,100+,5.0,0.0,20M,Rated for 3+,3.0,"Mar 21, 2019",,False,3.8,"['ai.bliq.ride', 'com.taxicaller.app', 'net.jerryhuang.WeTheDrivers', 'com.ridetada', 'nz.co.celo.app']",9.0
Wonda Cab,Taxi Service in Nigeria,True,Travel & Local,100+,8.0,0.0,5.2M,Rated for 3+,5.0,"Nov 5, 2018",,False,3.5,"['com.upwork.android.apps.client', 'com.brightwellpayments.android', 'com.jivosite.mobile', 'com.upwork.android.apps.main', 'com.guuru.experts']",0.0.1
Kwikie,Kwikie is a ride-hailing app for requesting a fast and affordable ride.,True,Maps & Navigation,100+,9.0,0.0,29M,Rated for 3+,5.0,"Jul 24, 2019",,False,3.6666667,"['com.taamcab.catchuser', 'com.picndrop.Driver', 'soft.gelios.com.space', 'com.facedrive', 'com.karwatechnologies.karwataxi']",3.0.0
Nigeria Hajj Guide,Nigeria Hajj Guide has easy instructions for Muslims to perform Hajj.,True,Travel & Local,100+,,0.0,11M,Rated for 3+,0.0,"Aug 10, 2017",,False,0.0,"['com.hasshub.hajjoumrah', 'com.alhuda.quranic.masnoon.supplications', 'com.mejrabsoft.masnoonjanaza', 'com.dawateislami.rohanielaj', 'com.islam.asta.an_nasai']",1.0
Coal City Connect,Enugu to the World,True,Maps & Navigation,100+,,0.0,Varies with device,Rated for 3+,0.0,"Oct 20, 2017",True,False,0.0,"['com.inadaydevelopment.cashcalculator', 'com.segitiga.fc10bapro', 'com.asturias.pablo.pasos', 'cn.com.calculator.finance', 'com.ameyniel.credit']",1
WaZoBia Translator,"Translates from English to yoruba, hausa and igbo languages",True,Travel & Local,100+,,0.0,11M,Rated for 3+,0.0,"Jan 8, 2019",,False,0.0,"['en.yo.bestdict', 'com.hypertonicapps.hausaenglishtranslator', 'all.language.translator.hub.englishtohausatranslator', 'en.ha.bestdict', 'com.hdictionary.yo']",1.1
Citikab,Citikab is the best On cab service app.,True,Travel & Local,100+,,0.0,7.8M,Rated for 3+,0.0,"Jul 18, 2019",,False,0.0,"['com.sherpas.takeoutfood', 'com.zaotec.hirefare', 'com.taxigo.taksojuht.ee', 'com.dtc.dtccustomer', 'com.taxigo.ee']",1.0
Epic Rider,"Comfortable, Secure and safe way to travel.",True,Travel & Local,100+,,0.0,25M,Rated for 3+,0.0,"Sep 16, 2019",,False,0.0,"['my.com.thelorry.ken.thelorrypartner', 'com.interfacom.taximes', 'com.pickupp.userapp', 'com.shipox.driver', 'tech.suzero.route']",3.0.17
TouchDownNigeria (TDN),"You can check the status of the flights anytime, anywhere for Nigerian airports.",True,Travel & Local,100+,,0.0,Varies with device,Rated for 3+,,,,False,,"['com.motorsportmag.gomobile.motorsport', 'com.zapek.android.gvamobile', 'com.audionowdigital.player.voasomali', 'com.application.euroairport']",Varies with device
kpando,Kpando is an address location app based on Natural Area Code.,True,Maps & Navigation,500+,,0.0,1.6M,Rated for 3+,0.0,"Jan 27, 2020",,False,0.0,"['com.rmtheis.geo', 'cz.mendelu.gisella', 'com.atlogis.mallorca', 'com.trafficspotter.android', 'com.codesector.maverick.full']",1.0
Lagos Guide,Lagos travel guide  is made for tourist and resident,True,Travel & Local,100+,,0.0,3.5M,Rated for 3+,0.0,"Oct 3, 2014",True,False,0.0,"['com.hqbytes.eva', 'com.hqbytes.cca', 'com.pledge51.nigerianconstitution', 'com.martinvillar.android.biblekjvpro', 'newking.james.bible.version.free']",
Abuja Metro Map Offline,Nigeria metro map for Abuja visitor that using metro Subway tram lines,True,Maps & Navigation,100+,,0.0,3.5M,Rated for 12+,0.0,"Apr 24, 2019",True,False,0.0,"['com.ulmon.android.playlondonofflinemap', 'com.amadeus.mercimdp.wb', 'com.apptastic.parismetromap', 'com.rndapp.mtamap', 'com.thryvinc.parismap']",1.0
Lagos Travel Guide in English with map,"Lagos Travel Guide in English with map, offline lists and recommendations",True,Travel & Local,100+,,0.0,40M,Rated for 3+,0.0,"Apr 18, 2018",,False,0.0,"['com.minube.guides.majorca', 'com.minube.guides.portugal', 'com.minube.guides.minorca', 'com.aerostatmaps.corfu', 'com.aerostatmaps.paris']",6.9.17
Mizi,Fast and reliable bus transportation service application.,True,Travel & Local,100+,,0.0,Varies with device,Rated for 3+,,,,False,,"['com.facedrive', 'com.gigm', 'com.cowry', 'com.taxicaller.app', 'via.viavan.driver']",Varies with device
GLT Nigeria Rider app,Greenlight rider application,True,Travel & Local,100+,,0.0,12M,Rated for 3+,0.0,"Oct 7, 2017",,False,0.0,"['com.ryde_android', 'com.loungeup.mtpa', 'com.hitchplanet.android', 'com.destinia.m', 'com.innovat.ccmobile']",1.5
RoadRacers,"We specialize in Airport Transfers, Private taxi service.",True,Travel & Local,100+,,0.0,6.6M,Rated for 3+,0.0,"May 9, 2018",True,False,0.0,"['com.gigm', 'com.wakanow.android', 'com.airazman.android', 'com.hititcs.arikair', 'com.anhong.SkyCargoLtd']",1.0
Sole Ride,Get a ride across Nigeria or make money on your trip driving your own car.,True,Travel & Local,100+,,0.0,9.9M,Rated for 3+,0.0,"Feb 7, 2019",,False,0.0,"['com.kicksonfire.android', 'com.goxip.app', 'com.klekt', 'com.mobimanage.sandals', 'com.hanon.shop']",3.8
Kano Jigoro MAP,"Jigoro Kano Map introduces places connected to Kano Shihan, the founder of judo.",True,Travel & Local,100+,,0.0,4.4M,Rated for 3+,0.0,"Aug 19, 2019",,False,0.0,"['net.ugik.tta.pro', 'net.rdyonline.judo', 'com.andreideiu.threedgains', 'com.triactivemedia.boxingnewsuk', 'tdr.pro.mouscolin.topplan']",1.0.4
Brekete Taxi,eTaxi Like no other,True,Travel & Local,100+,7.0,0.0,18M,Rated for 3+,6.0,"Feb 3, 2020",,False,3.2857144,"['com.amadeus.merci.kq', 'pt.geolink.taxilinkclient', 'com.bookinggroup2.economybookings', 'com.itsmyride.passenger', 'com.taxicaller.app']",4.5.5
VRide,Find the best affordable rides in Nigeria!,True,Travel & Local,100+,,0.0,16M,Rated for 3+,0.0,"Dec 5, 2019",,False,0.0,"['com.cowry', 'com.quickteller.app', 'com.gigm', 'com.wemabank.alat.prod', 'tingtel.android']",4.4.2
WakaNaija,"Services, Business in Nigeria",True,Travel & Local,50+,8.0,0.0,7.5M,Rated for 3+,4.0,"May 10, 2017",True,False,5.0,"['com.cowry', 'com.anhong.SkyCargoLtd', 'com.gigm', 'com.quickteller.app', 'moneymie.bank.nigeria.remit.sendmoney']",1.0.5
Renccas Hotel,Book and enjoy extraordinary experiences in Renccas Hotel & suites.,True,Travel & Local,50+,6.0,0.0,4.4M,Rated for 3+,4.0,"Jun 18, 2020",True,False,4.8333335,"['com.opprtunity.opprtunityapp', 'com.hstech.marbella', 'com.guidewithme.new.york']",1.0
Colgene Taxi,"Colgene Taxi - Safe, Comfortable, Reliable Corporate Taxi App",True,Maps & Navigation,50+,6.0,0.0,11M,Rated for 3+,6.0,"Jan 18, 2020",,False,4.3333335,"['com.taxicaller.dispatch', 'com.taxicaller.app', 'com.taxime.client', 'com.mydriver.customer', 'ai.bliq.ride']",0.3
Abuja - Wiki,Abuja Utility App.,True,Travel & Local,50+,,0.0,28M,Rated for 3+,0.0,"Aug 4, 2018",True,False,0.0,"['nz.govt.mfat.auhandbook', 'com.amadeus.mercimdp.wb', 'com.airtahitinui.companionapp', 'com.aerostatmaps.paris', 'net.pruvo.mobile']",1.0.8
PickMe (Nigeria),PickMe (Nigeria) is a transportation booking app.,True,Travel & Local,100+,5.0,0.0,11M,Rated for 3+,3.0,"Jan 7, 2020",,False,4.8,"['com.safeboda.driver', 'com.kentae.market', 'com.gigm', 'com.scb.breezebanking.ug', 'com.paywaytalk']",2.0.1
BestRide Driver,Drive with BestRide. Get better commission and more promos. We are your partner,True,Travel & Local,100+,,0.0,5.5M,Rated for 3+,0.0,"Sep 10, 2018",,False,0.0,"['com.aella.comportal', 'com.transsnetfinancial.palmcredit', 'io.quickcheck.loans', 'com.quickteller.app', 'com.ng.ninecredit']",1.7.1
Abuja Bus Map Offline,Abuja Bus Map offline app for Nigeria tourist or visitor,True,Maps & Navigation,50+,,0.0,3.8M,Rated for 12+,0.0,"Jun 1, 2019",True,False,0.0,"['com.amadeus.mercimdp.wb', 'metroexpress.doha', 'com.airazman.android', 'com.rndapp.mtamap', 'com.wakanow.android']",1.0
DriveMyMoto (DMM),Need a Driver? Get the DMM app,True,Travel & Local,50+,,0.0,58M,Rated for 3+,0.0,"Apr 30, 2019",,False,0.0,"['com.dmm.user', 'cz.chladek.mobiusactioncam', 'com.toobaya.mobile.superrichthailand', 'com.wws.glocalme', 'com.robskie.tether']",1.7.4
"Nigeria Travel & Explore, Offline Tourist Guide","Nigeria Travel Guide for places, routes, map, art, cuisine & more!",True,Travel & Local,100+,,0.0,11M,Rated for 3+,0.0,"Jan 16, 2019",True,False,0.0,"['com.js.guide.nyc', 'com.ulmon.android.playdubai', 'com.js.guide.paris2', 'com.dtcm.dubaitourism', 'com.hotels.booking.dubai']",1.0.6
PAT Driver,PAT is a premier taxi operator in Nigeria.,True,Maps & Navigation,100+,,0.0,23M,Rated for 3+,0.0,"Mar 16, 2020",,False,0.0,"['com.gigm', 'it.trisolutions.taxibo', 'com.qualtrics.offlinesurveys', 'com.terracom.gr.kerverosqrpatrol']",1.0.0
uTalk Igbo,"Learn the basics of a language quickly with images, speech and games.",False,Travel & Local,50+,,1990.0,17M,Rated for 3+,0.0,"Oct 3, 2012",,False,0.0,"['com.dictionary.ig', 'com.pronunciatorllc.bluebird.yoruba', 'com.felinkotech.superenglishandigbobible', 'com.robtheis.android.phrasebook.jb.bc', 'com.pronunciatorllc.bluebird.hausa']",1.1.1
uTalk Yoruba,"Learn the basics of a language quickly with images, speech and games.",False,Travel & Local,50+,,1990.0,16M,Rated for 3+,0.0,"Oct 10, 2012",,False,0.0,"['com.hdictionary.yo', 'net.yorubabible.audiobible', 'com.sadaqaworks.yorubaquran', 'air.yoruba101', 'com.pronunciatorllc.bluebird.yoruba']",1.1.1
Lagos Del Calafate Hotel,Mobile app which gives you a complete hotel experience at your fingertips,True,Travel & Local,"1,000+",5.0,0.0,21M,Rated for 3+,2.0,"Oct 26, 2020",,False,4.0,"['com.app.thrilliantnigeriatvc', 'newking.james.bible.version.free', 'sv.elsalvador.noticias', 'jp.co.zigexn.tcv', 'com.emisorasunidas']",1.12.70
Imo Hotels Booking,"Find and book hotels in imo state using the Imo Hotels booking app, it's Free",True,Travel & Local,100+,8.0,0.0,4.5M,Rated for 3+,6.0,"Sep 28, 2020",,False,4.875,"['com.secure.cryptovpn', 'com.halleyvpn.freevpn', 'com.tejuri.app.walif', 'com.almuzaini.almuzaini', 'com.candylink.openvpn']",3.7
Jospet Cab,Jospet Cab is the smartest way to get around. Just one tap to call the cabs.,True,Travel & Local,50+,,0.0,12M,Rated for 3+,0.0,"Sep 7, 2019",,False,0.0,"['com.taxicaller.app', 'com.robytechnologies.roby', 'com.geckolab.eotaxi.passenger', 'com.carsscanner', 'com.goldcar.app']",1.3
Abuja Tourist Map Offline,Abuja Tourist Map is your free travel companion in Abuja,True,Maps & Navigation,100+,,0.0,3.7M,Rated for 12+,0.0,"Jun 24, 2019",True,False,0.0,"['com.ulmon.android.citymaps2go', 'com.airtahitinui.companionapp', 'com.js.guide.nyc', 'com.ulmon.android.citymaps2gofull', 'com.aerostatmaps.paris']",1.0
Wonda Driver,Taxi service in Nigeria,True,Travel & Local,50+,,0.0,6.6M,Rated for 3+,0.0,"Oct 31, 2018",,False,0.0,"['com.payremit.mobileapp', 'com.kingschat.kingspay', 'com.anhong.SkyCargoLtd', 'moneymie.bank.nigeria.remit.sendmoney', 'com.guuru.experts']",0.0.4
SuaveXpress,SuaveXpress is a reliable delivery service in the heart of Lagos.,True,Travel & Local,50+,,0.0,3.9M,Rated for 3+,0.0,"May 2, 2019",,False,0.0,"['com.ideatolife.foodak2020', 'com.keddad.live', 'com.nipek.cdcare', 'com.itskillscenter.agsnew', 'com.cowry']",1.3
Amrole,Ride With Amrole,True,Travel & Local,10+,8.0,0.0,23M,Rated for 3+,5.0,"Aug 14, 2020",,False,5.0,"['com.cowry', 'com.safeboda.driver', 'com.gigm', 'com.cafejavas', 'com.food.ordering']",1.4
Monique Motors Ltd,"Comfortable, Safe and Affordable Travel Agency.",True,Travel & Local,10+,8.0,0.0,13M,Rated for 3+,8.0,"Nov 6, 2020",,False,5.0,"['it.guides.app', 'com.whizascoot.reactnative.app', 'visualengines.mmg.Piaggio', 'air.au.com.aokangels.oracle', 'com.obtech.catholicmissalcombined']",1.0.2
Cypress Logistics,Domestic courier solution,True,Maps & Navigation,10+,6.0,0.0,25M,Rated for 3+,6.0,"Sep 25, 2020",,False,5.0,"['com.maersk.mcctransport', 'com.dlink.nucliasconnect', 'org.mavlink.qgroundcontrol', 'com.runcam.runcam2', 'com.ixia.ixchariot']",1.3.0
1click9ja,"One click access to Travel, Real-Estate and Everything in-between.",True,Travel & Local,10+,15.0,0.0,36M,Rated for 3+,12.0,"Mar 27, 2018",True,False,4.866667,"['com.autochek.buysalefixcars', 'com.facedrive', 'com.airazman.android', 'com.hititcs.arikair', 'com.anhong.SkyCargoLtd']",3.0
Nandas Hotel,"Nandas Hotel Sagamu town, Ogun State, Nigeria.",True,Travel & Local,10+,,0.0,2.9M,Rated for 3+,0.0,"Nov 23, 2019",,False,0.0,,10.0
Lagos Travel Guide & Map,Lagos Travel Guide & Map,False,Travel & Local,10+,,197.37,"1,015k",Rated for 3+,0.0,"Dec 20, 2012",,False,0.0,"['com.ulmon.android.citymaps2gofull', 'com.hqbytes.cca', 'org.mapapps.mapyourtown.limassol', 'com.anhong.SkyCargoLtd', 'com.guidewithme.new.york']",2.0
Amrole Driver,Ride with Amrole,True,Travel & Local,10+,,0.0,23M,Rated for 3+,0.0,"Aug 14, 2020",,False,0.0,"['com.anhong.SkyCargoLtd', 'com.cowry', 'com.gigm', 'com.univasa.provider', 'com.kwik.messenger']",1.5
Anambra Metro Vault,Anambra Metro Vault is a digital application.,True,Travel & Local,10+,,0.0,7.8M,Rated for 3+,0.0,"Jul 6, 2020",,False,0.0,"['com.opl.transitnow', 'com.anilvasani.myttc.old', 'com.discoverukraine.metro.dubai', 'com.discoverukraine.metro.athens', 'com.dtc.dtccustomer']",1.0.4
"Enjoy Osun - Places to visit in Osun, Nigeriaâœ“â˜…â¤",Enjoy Nigeria tourism like never before with best places to visit in Osun State,True,Travel & Local,50+,,0.0,4.2M,Rated for 3+,0.0,"Sep 5, 2019",True,False,0.0,"['com.wakanow.android', 'org.mapapps.mapyourtown.iceland', 'net.pruvo.mobile', 'com.amadeus.mercimdp.wb', 'com.airazman.android']",1.0.1
"Aviator Travels - Book Flights, Hotels & Cruises",Aviator Travels specialize in delivering quality travel management.,True,Travel & Local,10+,,0.0,15M,Rated for 3+,0.0,"Apr 17, 2019",,False,0.0,"['com.lastminuteone.flight', 'net.appcheapflights', 'com.flightsbooking.tickets.app', 'com.wakanow.android', 'com.orbitz']",1.0
Surf Driver,"Surf is a ride-hailing app for fast, reliable rides in minutes.",True,Travel & Local,10+,,0.0,14M,Rated for 3+,0.0,"May 8, 2019",,False,0.0,"['com.taxif.passenger', 'com.taxif.driver', 'com.taamcab.catchuser', 'com.goteclabs.captain', 'com.goteclabs.customer']",1.0.1
uTalk Hausa,"Learn the basics of a language quickly with images, speech and games.",False,Travel & Local,10+,,1990.0,16M,Rated for 3+,0.0,"Oct 2, 2012",,False,0.0,"['com.pronunciatorllc.bluebird.hausa', 'me.devinco.smarteach.us', 'com.dictionary.ha', 'com.hdictionary.ha', 'com.atistudios.italk.us']",1.1.1
findAM NAIJA,Mobile App to find things around users in Nigeria.,True,Maps & Navigation,10+,,0.0,7.7M,Rated for 3+,0.0,"Oct 23, 2016",True,False,0.0,"['com.hymnals.sourcecodings.cshymns', 'com.plentywaka.rider.app', 'com.univasa.provider', 'com.pledge51.nigerianconstitution', 'ng.jiji.app']",0.0.1
Makeigo,Online Bus Ticket Booking on the Go!,True,Travel & Local,10+,,0.0,1.7M,Rated for 3+,0.0,"Jun 16, 2019",,False,0.0,"['com.app.m1remit', 'com.gigm', 'com.Barwa', 'com.ntpayments.ntwallet', 'com.maduroandcurielsbankbonaire.banking.app']",1.0
