title,summary,free,genre,installs,ratings,price,size,contentRating,reviews,released,adSupported,sale,score,similarApps,version
SPEPH,Official Mobile Application for SPE Port Harcourt section,True,Education,10+,,0.0,15M,Rated for 3+,0.0,"Sep 26, 2019",,False,0.0,"['com.itmedicus.emdex', 'branham.dreams.visions', 'com.scholarly.putme.uniport', 'com.neolife.exigobo', 'com.internet.loveworldradio']",2.0
The Hawthorn School,"The Hawthorn School, IQSS, SIS, SMS, School Angel, School Management System",True,Education,50+,,0.0,12M,Rated for 3+,0.0,"Jun 1, 2019",,False,0.0,"['com.gidimo', 'com.univasa.provider', 'com.bw.etaxcard.abia', 'com.hqbytes.cca', 'com.aella.comportal']",2.4
CommuniiTel,CommuniiTel app takes a new approach to Oral English language teaching.,True,Education,10+,,0.0,12M,Rated for 3+,0.0,"Jan 28, 2020",,False,0.0,"['com.scholarly.putme.uniport', 'com.scholarly.putme.oau', 'com.scholarly.putme.nda', 'com.axumtechnologies.jambite', 'hiclass.com.hiclass']",2.0
Sam 'O' Schools,Sam 'O' Schools Smart Academic Software System,True,Education,10+,,0.0,10M,Rated for 3+,0.0,"May 2, 2019",,False,0.0,"['com.spaceso2o.superapp', 'com.aella.comportal', 'com.ng.ninecredit', 'com.univasa.provider', 'com.gidimo']",1.0
Footsteps Nursery School,"Footsteps Nursery School, IQSS, SIS, SMS, School Angel, School Management System",True,Education,10+,,0.0,11M,Rated for 3+,0.0,"Jul 29, 2019",,False,0.0,"['com.mogparadio.radio', 'com.yotoplay.yoto', 'com.musictime.android']",2.3
Pearls Garden Schools,Pearls Garden Schools Smart Academic Software System,True,Education,10+,,0.0,7.2M,Rated for 3+,0.0,"Jul 15, 2019",,False,0.0,"['co.tradedepot.shop', 'com.ifs.banking.fiid3605', 'com.finch_agent_mobile_app', 'com.giftedhands.app', 'moneymie.bank.nigeria.remit.sendmoney']",4.0
Preston Model School,Preston Model Smart Academic Software System,True,Education,10+,,0.0,8.6M,Rated for 3+,0.0,"Aug 14, 2019",,False,0.0,"['com.unlitechsolutions.upsmobileapp', 'com.eZone.app', 'com.rewardgateway.mob_04']",1.0
Emilio Piazza Memorial School,Emilio Piazza Memorial School SASS,True,Education,50+,,0.0,7.6M,Rated for 3+,0.0,"Jan 15, 2019",,False,0.0,"['com.piazza.android', 'com.myneveo.mobile', 'com.cloudspringtech.kortext', 'com.mobisystems.msdict.embedded.wireless.collins.italian', 'education.glose.android']",43.0
Green Berryfield School,Green Berryfield School Smart Academic Software System,True,Education,10+,,0.0,12M,Rated for 3+,0.0,"Mar 25, 2019",,False,0.0,"['com.aella.comportal', 'com.univasa.provider', 'com.finch_agent_mobile_app', 'com.transsnetfinancial.palmcredit', 'com.wemabank.alat.prod']",1.0
Childrens HomeStead School,Childrens Homestead School Smart Academic Software System,True,Education,10+,,0.0,8.3M,Rated for 3+,0.0,"Aug 14, 2019",,False,0.0,"['com.aella.comportal', 'com.ng.ninecredit', 'io.quickcheck.loans', 'com.nigeria.soko', 'com.transsnetfinancial.palmcredit']",1.0
NEVS BETA,NEVS Beta is an acronym of Nigerian Education Verification System Beta.,True,Education,10+,,0.0,106k,Rated for 3+,0.0,"Mar 24, 2020",,False,0.0,"['com.quizover.app.course.col11613', 'com.josephjawahkebbie.wasscesyllabus', 'com.learnazure.app', 'com.manageengine.sdp.ondemand', 'itsmcqsapp.com.computerscience']",1.0
KDL: Kids Digital Library,A digital library of educational videos and books for students from age 1-15.,True,Education,50+,,0.0,11M,Rated for 3+,0.0,"Oct 15, 2020",True,False,0.0,"['org.asiafoundation.letsread', 'com.intuary.farfaria', 'com.vooks', 'com.hooplakidzplus', 'air.com.unik.phonicsfun1Lite']",1.0.1
Naija Campus Views,"This is a social networking portal where members share educational memories,",True,Education,10+,,0.0,1.8M,Rated for 3+,0.0,"Oct 13, 2019",True,False,0.0,"['com.itskillscenter.agsnew', 'com.mobileaccord.geopollinterviewer', 'com.userlytics.recorder', 'ly.bonus.android', 'make.money']",4
Dialect Fashion Academy,A mobile app for students of Dialect Fashion Academy,True,Education,10+,,0.0,3.8M,Rated for 12+,0.0,"Dec 20, 2017",True,False,0.0,"['spaced.repetition.mandarin.chinese.learning.vocabulary.builder', 'com.titan.app.verb.Portuguese', 'tienjoneey.com.minano_english', 'uk.co.lcstudios.learnchinese', 'com.en45.android']",1.0
JBL Web Learning,This a mobile application that will run on android platform to  teach HTML basic,True,Education,50+,,0.0,99M,Rated for 3+,0.0,"May 29, 2018",,False,0.0,"['com.onkyo.jp.onkyoremote', 'com.lenbrook.sovi.bluesound', 'com.sony.songpal.dj', 'com.wifiaudio.Stream', 'de.jbl.proscan']",1.1.1
Kalac Schools,"Kalac Schools, a World class school offering both Nigerian and British Curricula",True,Education,10+,,0.0,8.4M,Rated for 3+,0.0,"May 5, 2020",True,False,0.0,"['com.giftedhands.app', 'com.josephjawahkebbie.wasscesyllabus', 'agexdev.commerce', 'com.axumtechnologies.jambite', 'com.quizover.app.course.col11613']",9.9
GOSHEN GROUP OF SCHOOLS,This technology will enhance parents participations in their children academics.,True,Education,50+,,0.0,1.3M,Rated for 3+,0.0,"Feb 7, 2019",,False,0.0,,1.0
Yali T.v,Yali T.v Mobile App is an internet television set with interactive features...,False,Education,10+,,200.0,15M,Rated for 12+,0.0,"Nov 25, 2018",True,False,0.0,"['org.x90live.arsenal', 'io.ionic.tvdapp', 'tbn_mobile.android', 'apps.pandoutah.radio.rwanda']",1.0
JBL Web Learning,This a mobile application that will run on android platform to  teach HTML basic,True,Education,50+,,0.0,99M,Rated for 3+,0.0,"May 29, 2018",,False,0.0,"['com.onkyo.jp.onkyoremote', 'com.lenbrook.sovi.bluesound', 'com.sony.songpal.dj', 'com.wifiaudio.Stream', 'de.jbl.proscan']",1.1.1
RAGP 2021,Make Money by Joining Recharge and get Paid Today,True,Education,50+,,0.0,6.2M,Rated for 3+,0.0,"Dec 16, 2020",,False,0.0,"['com.gidimo', 'com.ajocard.app.prod', 'com.vanstone.vm20sdk', 'app.vtpass.com', 'com.qsoft.aidapay']",1.0
ST VINCENT DE PAUL,"St. Vincent De Paul National Secondary School, Enugu, Nigeria",True,Education,10+,,0.0,1.5M,Rated for 3+,0.0,"May 29, 2020",,False,0.0,"['com.hymnals.sourcecodings.cshymns', 'com.zenithbank.zenithetoken', 'the.family.alter', 'ng.bytelabs.watu', 'com.gidimo']",1.0
Posh Oak Academy Mobile,Digital preschool management solution.,True,Education,10+,,0.0,6.0M,Rated for 3+,0.0,"Aug 21, 2019",,False,0.0,"['com.kongapay.android', 'com.gigm', 'punchmobile.punchng', 'com.airazman.android', 'com.kentae.market']",0.0.5
UniPort Online Tutorials,Quality e-Learning Experience on the Go!,True,Education,50+,,0.0,38M,Rated for 3+,0.0,"Nov 4, 2019",,False,0.0,"['com.genm.genm', 'web.webdev.webdevelopment.createwebsite.makewebsite.learnwebsite.learnweb.html', 'com.udemy.android.ufg', 'com.mobile.simplilearn', 'com.OpenLearningClient']",3.0
Glorious Schools,Every child is a potential,True,Education,10+,,0.0,639k,Rated for 3+,0.0,"Sep 16, 2018",,False,0.0,"['com.dub.app.unt', 'com.greedge.wordbot', 'com.mobisystems.msdict.embedded.wireless.oxford.amdictandthes', 'javalc6.thesaurus', 'com.microsoft.chineselearning']",1.0
iFarm Reality Tv Show,The ifarm reality TV show is an initiative of ARDA featuring Agro business,True,Education,10+,,0.0,2.1M,Rated for 3+,0.0,"Feb 13, 2020",,False,0.0,"['com.thespacetv', 'com.platinumlist', 'com.fox.droid.foxwnyw', 'com.publicmediaapps.montanapbs', 'com.daystar']",1.0
Igbo Japanese Translator,"Free translator from Igbo to Japanese, and from Japanese to Igbo",True,Education,10+,,0.0,16M,Rated for 3+,0.0,"Oct 2, 2017",True,False,0.0,"['com.hypertonicapps.hausaenglishtranslator', 'com.dictionary.ja', 'com.appcool.japanese', 'com.ndcsolution.jdict', 'com.bravolang.dictionary.japanese']",2.0.9
UI-LAW18 Yearbook,"Official database (Yearbook) App of the class of 2018, Faculty of Law, UI.",True,Education,10+,,0.0,8.4M,Rated for 3+,0.0,"Oct 21, 2018",,False,0.0,"['edu.durhamcollege.app', 'net.ifao.android.cytric', 'com.ns_apps.qpretest', 'com.texidium.ereader', 'com.microstrategy.android.dossier']",1.0
Divine International School,"Your personalized e-Campus, where students, parents & teachers can be connected.",True,Education,"1,000+",36.0,0.0,36M,Rated for 3+,13.0,"Jun 2, 2020",,False,3.6111112,"['co.bolton.abhysi', 'com.edutinkerapp']",1.2
Winners Chapel Port Harcourt,Church Management Application,True,Education,10+,,0.0,25M,Rated for 3+,0.0,"May 11, 2020",,False,0.0,"['com.goodbarber.wealthbuilder', 'com.lfcww.cits', 'com.id1mkl2ywshfiru15cwj', 'com.mightybell.wealthbuilders', 'com.churchlinkapp']",1.1.2
Teach The Child,To promote positive values in the lives of Children and Young People.,True,Education,50+,,0.0,4.0M,Rated for 3+,0.0,"Jun 12, 2019",,False,0.0,"['com.DVloper.HouseOfSlendrina', 'com.dvloper.slendrinax', 'com.glaznev.whoisthekiller4', 'com.dvloper.slendrina', 'com.maya.android']",1.1
Agricmechapp,Guides for mechanized  farming in Aninri L.G.A of Enugu state Nigeria.,True,Education,10+,,0.0,Varies with device,Rated for 3+,,,,False,,"['com.mtpelerin.bridge', 'co.tradezero.zeromobile', 'com.tastyworks.app', 'com.gcc.exchange', 'com.finimize.oban']",Varies with device
Tafarki Madaidaici II,Fassarar Littafin Iqtida'u Siradul Mustaqim,True,Education,100+,,0.0,42M,Rated for 3+,0.0,"Apr 15, 2020",True,False,0.0,"['com.sadiksalihu.fassararlittafinahdhari', 'com.sadiksalihu.littafinhisnulmuslim', 'com.sadiksalihu.tsarki']",2.8
TAASC Benin,"Topmost Academy for Art, Science and Computer, Cotonou, Republic of Benin.",True,Education,10+,,0.0,16M,Rated for 3+,0.0,"Jun 24, 2020",,False,0.0,"['nz.govt.mfat.auhandbook', 'com.senenews', 'uol.digster']",1.0.47
FREE 15 IN 1 NIGERIAN LITERATURE (SUMMARY),This mobile app with compatible with all devices,True,Education,"10,000+",33.0,0.0,4.5M,Rated for 3+,21.0,"Mar 25, 2019",,False,3.939394,"['com.scholarly.putme.oau', 'com.iafsawii.flashlearners.waec.ssce', 'com.enotes.app', 'com.quizover.app.course.col11762', 'com.infinite.booksummary']",1.0.0
ALPHA REHOBOTH SCHOOLS PARENT PORTAL,"This is mobile App for parents of Alpha Rehoboth Schools, Egbeda, Lagos.",True,Education,50+,,0.0,7.5M,Rated for 3+,0.0,"Sep 18, 2019",True,False,0.0,['com.edadmin.parentapp'],9.4
WAFCOL,WAFCOL is a private nonprofit Religious Education Institution.,True,Education,10+,11.0,0.0,1.4M,Rated for 3+,11.0,"Apr 21, 2017",,False,5.0,"['com.nuvek.scriptureplus', 'com.masterlectures', 'com.subsplash.thechurchapp.s_2WKDC5', 'com.sourceviewbible', 'com.biblicaltraining']",1.0
EELWapp,Official Mobile Application for Entrepreneurship Enablement and Leadership Week,True,Education,10+,5.0,0.0,3.0M,Rated for 3+,2.0,"Jun 6, 2018",,False,4.6,"['uk.ac.strath.mis.mpegasus', 'com.litcharts', 'com.genm.genm', 'com.dfs.android', 'com.quizover.app.course.col11613']",1.0.7
Greenwood House School,Greenwood House School Mobile Application,True,Education,100+,,0.0,12M,Rated for 3+,0.0,"Jul 11, 2019",,False,0.0,"['com.gh.sammie.lessonplan', 'spelling.skynetcomputing.com.au.spelling', 'com.spencerlearning.ultimatephonics', 'com.pdemp.myreadingwords', 'effortlessmath.commoncore6th']",2.4
Salem University Lokoja,Raising Global Leaders,True,Education,100+,,0.0,5.1M,Rated for 3+,0.0,"Jul 5, 2016",,False,0.0,"['uk.ac.ncl.m', 'com.ulmon.android.playveniceofflinemap', 'com.tourlandish.chronos', 'uk.ac.strath.mis.mpegasus', 'com.ccc.Limkokwing']",1.3.0
GBest POLYTECHNICS PUME,Contains Past Questions With Answers and Detailed Explanation from Polytechnics,True,Education,100+,,0.0,15M,Rated for 3+,0.0,"Jul 14, 2020",True,False,0.0,"['com.scholarly.putme.nda', 'com.scholarly.putme.oau', 'com.iafsawii.flashlearners.waec.ssce', 'com.axumtechnologies.jambite', 'com.iafsawii.flashlearners.jambcbt']",11.0.0
StartFromZero_Hausa,A starting point for you to continuously grow your Hausa vocabulary.,True,Education,100+,,0.0,2.8M,Rated for 3+,0.0,"May 3, 2017",True,False,0.0,"['com.language.learnafrikaans', 'com.robtheis.android.phrasebook.sm.bc', 'kuma.lingocards.haitiancreole', 'com.atistudios.mondly.af', 'all.language.translator.hub.englishtohausatranslator']",1.0
Skyline University Nigeria,Explore Skyline University Nigeria Portal with ease via android application...,True,Education,50+,,0.0,7.5M,Rated for 3+,0.0,"Nov 11, 2019",True,False,0.0,"['com.ifs.banking.fiid7416', 'com.tajbank.app', 'com.shago', 'com.npfltv.tv2u', 'com.axumtechnologies.jambite']",7.1
MyClass (University of Ilorin),"Up-to-date, Secure and Easy-to-Access Classroom Application for Students.",True,Education,"1,000+",26.0,0.0,10M,Rated for 3+,12.0,"Jan 17, 2020",,False,4.5384617,"['com.dub.app.unt', 'com.edevolearning.edevoteacher', 'com.talentcards.android', 'com.ccc.Limkokwing', 'com.aes.eflhandbook']",1.6.0
OYOMESI Series,Developed for the Oyo State students by OYOMESI,True,Education,50+,,0.0,20M,Rated for 3+,0.0,"May 23, 2017",,False,0.0,"['com.axumtechnologies.jambite', 'com.scholarly.putme.nda', 'com.scholarly.putme.uniport', 'com.hqbytes.cca', 'com.scholarly.putme.oau']",1.5
Louisville Girls Secondary School (LGSS) Abuja,Handy School Management App for News Updates and Checking of Results,True,Education,100+,5.0,0.0,28M,Rated for 3+,2.0,"Apr 10, 2019",,False,4.8,"['com.ibm.cognitiveapplications.dna', 'com.salesforce.socialstudio', 'com.gmd.WSOnDemand', 'com.eworksmanager.ewm', 'com.manageengine.sdp']",1.0
PJP2 Model Sec Sch Mbaise,"Pope John Paul II Model Secondary School, Ezinihitte Mbaise, Imo State, Nigeria",True,Education,100+,5.0,0.0,2.4M,Rated for 3+,2.0,"May 27, 2017",,False,5.0,,1.0.3
Trinity College,Quality e-Learning Experience on the Go!,True,Education,50+,,0.0,41M,Rated for 3+,0.0,"Aug 27, 2019",,False,0.0,"['edu.durhamcollege.app', 'com.gh.sammie.lessonplan', 'com.ilearnpapiamento.ned', 'com.giftedhands.app', 'com.puremath.algebra2']",3.0
"The Bells Schools, Ota","The official app of the Bells schools in Ota, Ogun State, Nigeria.",True,Education,50+,,0.0,3.3M,Rated for 3+,0.0,"Feb 19, 2020",,False,0.0,"['com.gidimo', 'commentary.bible', 'com.gnowbe.app', 'zw.co.rdsol.admire.afmhymns', 'com.ecodia.android.hymnlyrics']",1.0
COMLAG IPAJA,Command Secondary School Ipaja Lagos Alumni,True,Education,100+,,0.0,13M,Rated for 12+,0.0,"Sep 25, 2019",,False,0.0,"['uk.ac.ncl.m', 'com.dub.app.unt', 'eu.parent.android.app', 'com.acesoft.ITCertifications.ISACA.CISM', 'com.talentbox.afcquarterly']",3.7.191123
Akdari (Hausa da Turanci),Akdari (Hausa da Turanci),True,Education,500+,,0.0,4.2M,Rated for 3+,0.0,"Aug 26, 2020",,False,0.0,,1.0
EASY EDUCATION,"EASY EDUCATION CONSULTING SERVICES, EEDU, ADMISSION MADE EASY, SCHOLARSHIPS",True,Education,100+,,0.0,755k,Rated for 3+,0.0,"Dec 27, 2019",,False,0.0,"['com.enotes.app', 'com.gigantic.periodictable', 'com.mheducation.readerShellApp.readAnywhere', 'com.ryzac.codecademygo', 'com.openstax.openstax']",1.0
Daily Revelation 2020,Daily Revelation 2020,True,Education,50+,,0.0,2.7M,Rated for 3+,0.0,"Mar 27, 2020",,False,0.0,"['com.DesenEnterprises.bpnt_BookApp', 'devotion.unlockingrevelation', 'com.alcaldebibliapps.desire.ages.adventist', 'com.desireofages', 'ca.contendforthefaith.HFB']",2.0
Hafydof,Hausa/Fulani Youth Development and Orientation Forum Hafydof Nigeria,True,Education,50+,5.0,0.0,94M,Rated for 3+,5.0,"Feb 20, 2019",,False,4.8,"['com.amir.coran', 'com.abdullahapps.quaranterabbanas', 'com.hisni', 'com.taha.rus.french', 'com.newandromo.dev767957.app875452']",2.0
CourseDig,CourseDig - directory of all courses on offer at all Institutions across Nigeria,True,Education,100+,51.0,0.0,2.3M,Rated for 3+,43.0,"Oct 29, 2018",,False,4.9215684,"['com.genm.genm', 'com.OpenLearningClient', 'org.commonapp.apply', 'com.certquestions.mobile.app', 'com.imptrax.cpa_exam_review_prep_practice_questions_flashcards']",1.1
NAPPS,Real-time notification and event information app for private school proprietors,True,Education,100+,,0.0,11M,Rated for 3+,0.0,"May 9, 2019",,False,0.0,"['cat.triangle.bcn', 'com.zoho.backstage', 'com.microstrategy.android.dossier', 'nz.govt.mfat.auhandbook', 'ca.umanitoba']",1.0.2
YearOneSuite,YearOneSuite is a quiz app developed for the university of port harcourt.,True,Education,100+,,0.0,6.3M,Rated for 3+,0.0,"Aug 23, 2019",True,False,0.0,"['com.skc.classroom', 'org.lighthousecatholicmedia.lcmbible', 'com.inductivebiblestudyapp', 'com.puremath.partialfraction', 'com.ombiel.campusm.plymouth']",4.0
Nuhu Bamalli Polytechnic,This application enables Nuba Poly Students to access the school portal...,True,Education,500+,7.0,0.0,6.6M,Rated for 3+,3.0,"Jul 18, 2019",True,False,4.857143,,6.0
Unimaid Radio,This is a radio streaming app for Unimaid Radio,True,Education,100+,,0.0,12M,Rated for 3+,0.0,"Dec 7, 2019",,False,0.0,"['apps.pandoutah.radio.rwanda', 'com.radiolight.nigeria']",1.0
YouthNomics,Helping youths identify their areas of strength and passion.,True,Education,100+,,0.0,7.8M,Rated for 3+,0.0,"Sep 24, 2019",,False,0.0,"['com.mobiwork.devices.android', 'com.softserveinc.tid', 'radixweb.ecat.ev2', 'com.meltwater.mobile', 'com.networkr']",1.2.0
UI POST UTME,University Of Ibadan Post UTME questions and answers App for offline practice,True,Education,"1,000+",15.0,0.0,4.5M,Rated for 3+,13.0,"Oct 8, 2020",,False,4.3333335,"['com.scholarly.putme.oau', 'com.iafsawii.flashlearners.jambcbt', 'com.axumtechnologies.jambite', 'com.iafsawii.flashlearners.waec.ssce', 'com.scholarly.putme.nda']",3.4.0
Regina Pacis College (RPC) Abuja,Portable Mobile Application for School Information and Management,True,Education,100+,,0.0,32M,Rated for 3+,0.0,"Sep 21, 2019",,False,0.0,"['uk.ac.strath.mis.mpegasus', 'org.worldbank.solutions.Vtester', 'com.mergdata.surveys', 'uk.ac.ncl.m', 'com.exolnet.itaccme']",1.2
Naija Poetry,Naija Poetry is a platform where individual talented poet can post poems.,True,Education,100+,5.0,0.0,59M,Rated for 3+,5.0,"Oct 6, 2017",,False,2.8,"['com.familyfriendpoems', 'vdmcreation.williamshakespearepoems', 'com.itskillscenter.agsnew', 'com.specpal.moonlessnight', 'jkakuffo.prayerroom']",7.0.0
National Entrepreneurship Platform - NEP,A convergence of Nigeria's finest minds providing toolkit and skillset,True,Education,100+,,0.0,12M,Rated for 3+,0.0,"Nov 16, 2019",True,False,0.0,"['com.neolife.exigobo', 'moneymie.bank.nigeria.remit.sendmoney', 'com.coinsuper.app', 'com.maz.entrepreneurr', 'business.ideas']",0.001
Laspo Social,Access Your Portal | Make Friends | Share Your Happy Moments,True,Social,100+,,0.0,8.0M,Rated for 3+,0.0,"Dec 12, 2019",True,False,0.0,"['com.enprohsoft.app.nevadabridgetv', 'com.giftedhands.app', 'moneymie.bank.nigeria.remit.sendmoney', 'com.qsoft.aidapay', 'com.gidimo']",3.0.1
Learn Abesabesi,The application promotes the learning of Ã€bÃ¨sÃ bÃ¨sÃ¬ language in our communities,True,Education,100+,,0.0,4.4M,Rated for 3+,0.0,"Jun 24, 2018",True,False,0.0,"['com.dictamp.englishfrench', 'km.learnarabicen1', 'com.sontung.esven', 'com.eslamdev.learnenglish', 'com.anna.english_vocabulary_3000_words']",1.0.0
holyapp,HolyApp for Holy Cross Secondary School Onitsha,True,Education,100+,,0.0,1.5M,Rated for 3+,0.0,"Jul 29, 2020",,False,0.0,"['com.edevolearning.edevoteacher', 'com.novakid.student', 'com.socrative.teacher', 'tv.myieltsclassroomgeneral.android', 'com.koben.thumbs']",1.0
LBS Alumni,"Re-connect with old alumni, give back, and expand your professional network.",True,Education,100+,,0.0,16M,Rated for 12+,0.0,"Jul 21, 2016",,False,0.0,"['rodney.android.ipv4subnetcalculator', 'com.soundconcepts.teamneolife', 'in.softecks.dcn', 'com.app4daily.computer3', 'com.a3vte.app']",202100.184.06
Arba'una Hadith,The most recognized App that contain 42 Hadith Al-Nawawi,True,Education,"1,000+",15.0,0.0,14M,Rated for 3+,9.0,"Oct 31, 2020",True,False,4.4,"['com.quranreading.sahihbukhari', 'hadith.selection', 'com.chaks.hadithsqudsi', 'com.chaks.nawawi', 'com.reda.daraqutni']",1.7.4
Ibadan International School,IIS offers 21st Century Education in the Heart of Ibadan,True,Education,100+,,0.0,21M,Rated for 3+,0.0,"Dec 1, 2018",,False,0.0,"['com.hooktheory.hooktheory_one', 'com.DigitalJalebi.MadinahArabicApp_P1', 'ooo.soroban.flashcalcanzan', 'com.lilu8k.musictheory', 'com.myrapps.musictheory']",1.0
BSN NIGERIA,The BSNN App showcases activities of the Alumni and students of BSN Nigeria.,True,Education,100+,,0.0,25M,Rated for 3+,0.0,"Jul 27, 2018",,False,0.0,"['com.digibix.bsnpr', 'com.martinvillar.android.biblekjv', 'newking.james.bible.version.free', 'co.moneymatch.app', 'com.iqjoy.ayoad.arisetv']",0.0.15
Your Language Guide in Nigerian,This App Translate the The most common spoken Languages in Nigeria to English,True,Education,500+,,0.0,4.9M,Rated for 3+,0.0,"Nov 30, 2019",True,False,0.0,"['com.learnlanguage.hausa', 'land.dict.dparha1.free', 'com.hypertonicapps.hausaenglishtranslator', 'all.language.translator.hub.englishtohausatranslator', 'com.dictionary.ha']",1.0.1
Land Tenure Concept in Nigeria,Learn The concept of land tenure system in Nigeria,True,Education,500+,,0.0,3.4M,Rated for 3+,0.0,"Jan 19, 2019",True,False,0.0,"['com.therichestmaninbabylon.richestmanbookpdf.tikapps', 'com.overwood.overwood', 'com.islam.asta.an_nasai', 'app.asharbhutta.com.habbitsofprophetmuhammad', 'com.islam.asta.muwatta_malik']",1.1
Paul Enenche Ministries,Paul Enenche Ministries,True,Education,100+,,0.0,3.2M,Rated for 3+,0.0,"Jun 3, 2019",True,False,0.0,"['com.martinvillar.android.biblekjv', 'spurgeon.sermons.preacher.AOUWSCTLELMOADBL', 'amplified.bible', 'com.ibad.tafsiribnkathir', 'com.beebli.beebli']",1.0
Ahdari,"Littafin Ahdari na Sheikh Shu'aibu Rabi'u, Imamud Da'awa, Zaria, Kaduna Nigeria.",True,Education,500+,,0.0,7.7M,Rated for 3+,0.0,"Jan 22, 2020",True,False,0.0,"['com.sadiksalihu.fassararlittafinahdhari', 'com.ruhuladab', 'com.sadiksalihu.littafinhisnulmuslim', 'com.audionowdigital.player.voahausa', 'com.newandromo.dev767957.app875452']",8.0
NOGC - Nigerian Oil & Gas Cases,The Nigerian Oil and Gas Cases (NOGC),True,Education,100+,,0.0,2.2M,Rated for 3+,0.0,"Dec 30, 2017",,False,0.0,"['oilprice.android.app', 'com.despdev.metalcharts', 'com.fibogroup.fiboforexdrive', 'co.tractionapp.traction', 'co.tradedepot.shop']",0.1
Abcel Academy,To Build Up Tomorrows Leader Through Completely Sound Education.,True,Education,100+,,0.0,8.1M,Rated for 3+,0.0,"Mar 26, 2020",,False,0.0,"['com.nigeria.soko', 'com.aella.comportal', 'com.enprohsoft.app.nevadabridgetv', 'com.fastmoney.loan.credit.cash.nigeria', 'com.pbank.newcredit']",9.9
DevFest Abuja,DevFests are community-led developer events hosted by Google Developer Groups,True,Events,50+,,0.0,13M,Rated for 3+,0.0,"Oct 10, 2019",,False,0.0,"['gov.cdc.ondieh.nccdphp.cdcdentalcheck', 'com.neolife.exigobo', 'com.nursebackpack.react', 'com.axonify.axonify', 'com.pbw.lawyerdiary']",1.0.4
Sharfadi Tech,Research and awareness forum on internet Sharfadi.com,True,Education,500+,15.0,0.0,4.5M,Rated for 12+,13.0,"Jul 20, 2019",True,False,4.5333333,"['com.hypertonicapps.hausaenglishtranslator', 'land.dict.dparha1.free', 'com.ecodia.android.hymnlyrics.hymnlyricsfree_hausa', 'com.learnsolo.hausadictionaryoffline', 'all.language.translator.hub.englishtohausatranslator']",5.1
CAPRO PPC,"CAPRO is an	international, interdenominational Christian Agency. Calvary Mission",True,Education,500+,19.0,0.0,7.6M,Rated for 3+,14.0,"Oct 2, 2018",,False,4.5263157,"['com.seosamba.socialmarketingseosamba', 'com.talentoz.www.talentoz', 'com.datadog.app', 'com.magnessa.distributors', 'niva.com.cameraupload']",4.5
VarsityScape - Social eLearning Community,Join a community of fast learning people. Find help in groups and forums.,True,Education,100+,18.0,0.0,42M,Rated for 12+,11.0,"May 31, 2020",,False,4.722222299999999,"['com.learnazure.app', 'com.genm.genm', 'com.ryzac.codecademygo', 'com.nicheinc.nichealpha', 'org.kiwix.kiwixcustomwikivoyageeurope']",1.1.5
Mnutrition,Mnutrition is an educative application,True,Education,100+,6.0,0.0,7.0M,Rated for 3+,4.0,"Jul 9, 2019",,False,5.0,"['com.parents.app', 'nursing.care.plans.app', 'com.gktalk.nursing_examination_app', 'hlt.nursing.com', 'com.VetApps.VetCalcPlus']",1.0
BAU LMS,"BAU and BAU Executive Education students can Learn, Interact and Study on the Go",True,Education,100+,7.0,0.0,3.5M,Rated for 3+,2.0,"Jan 9, 2017",,False,5.0,,1.2
Nigeria Paramilitary App,This app gives you information about Nigeria paramilitary agencies.,True,Education,"1,000+",5.0,0.0,4.2M,Rated for 3+,3.0,"Jan 14, 2020",True,False,3.6,"['org.boggi.esig.noads', 'com.sshh.me_aio', 'ru.chipenable.avrcalculator.free', 'com.skf.spacershaft', 'com.skf.values']",1.0
SOF - School Owners Forum,The Largest Training Platform Connecting Edu-Stakeholders & Resource Providers.,True,Education,500+,,0.0,6.7M,Rated for 3+,0.0,"Apr 2, 2019",,False,0.0,"['com.classe365', 'com.vipera.ts.starter.MashreqAE', 'com.edadmin.parentapp', 'com.microstrategy.android.webapp', 'com.Microsoft.Dynamics365forOperationsWarehousing']",1.0
Nigeria Scout,"Scouting helps youth develop academic skills, self-confidence, ethics ...",True,Education,500+,10.0,0.0,6.0M,Rated for 3+,8.0,"Jan 7, 2019",,False,4.4,"['moneymie.bank.nigeria.remit.sendmoney', 'ng.verifyme.agent', 'com.kashbase.spark', 'ng.chaka.android', 'com.aiscout.player']",1.0
Nigerian Correctional Service Exam Quiz(TRIAL),An exam revision quiz app for the Nigerian Corrections Service,True,Education,"1,000+",14.0,0.0,3.3M,Rated for 3+,7.0,"Sep 14, 2019",True,False,4.642857,"['com.edurev.gmat', 'com.aussizzgroup.ptetutorial', 'com.puremath.complexnumbers', 'agexdev.commerce', 'com.josephjawahkebbie.wasscesyllabus']",2.3
Ogitech,Ogitech Mobile Application For all Devices.,True,Education,"1,000+",16.0,0.0,24M,Rated for 3+,9.0,"Dec 10, 2018",,False,4.5625,"['com.sbb.unifon.mobi', 'com.edmark.loyaltyuser', 'com.lafaac.teachonmars.lafaac', 'com.visiotalent.app', 'com.pgi.gmmeet']",2.2
Go2Uni,GO2UNI aid students in schools in Nigeria in preparation for university exams,True,Education,500+,30.0,0.0,17M,Rated for 3+,16.0,"Jun 15, 2020",True,False,4.5,"['com.sbr_connect.steven.ptelite', 'com.giftedhands.app', 'com.unibuddy', 'com.lsatmax.exam', 'com.iafsawii.flashlearners.waec.ssce']",1.14
