title,summary,free,genre,installs,ratings,price,size,contentRating,reviews,released,adSupported,sale,score,similarApps,version
KeyMobile,Keystone Mobile brings Convenient and Reliable banking on your mobile device,True,Finance,"100,000+",3952.0,0.0,48M,Rated for 3+,2373.0,"Jan 21, 2018",,False,3.4221106,"['com.stanbicibtc.mobile', 'com.appzonegroup.fcmb', 'com.interswitchng.www', 'com.uba.vericash', 'com.ceva.firstmoniewallet']",1.6.16
SC Mobile Nigeria,"Take care of your banking requirements anytime, anywhere with SC Mobile",True,Finance,"500,000+",5569.0,0.0,84M,Rated for 3+,3278.0,"Jun 17, 2013",,False,3.4679716,"['com.stanbicibtc.mobile', 'com.wemabank.alat.prod', 'com.quickteller.app', 'com.qucoon.keystonemobilebankingapp', 'com.lenddo.mobile.paylater']",5.18.2
I-Invest,I-Invest Mobile App allows retail investors access financial instruments,True,Finance,"100,000+",615.0,0.0,34M,Rated for 3+,429.0,"Mar 23, 2018",,False,3.34,"['ng.chaka.android', 'com.rise.mobile', 'co.agropartnerships.android', 'com.cowrywise.android', 'co.troveapp.android']",3.1.6
Wealth.ng,"Invest in Bonds, Eurobonds, Stocks, Treasury Bills, Real Estate, and Agriculture",True,Finance,"50,000+",383.0,0.0,4.3M,Rated for 3+,279.0,"Sep 19, 2019",,False,3.27,"['com.cousant.naijainvest', 'com.rise.mobile', 'ng.chaka.android', 'newstocks.nigeria.nse', 'com.pettysave.app']",2.1.2
Wahed Invest,Ethical Investing Made Simple,True,Finance,"100,000+",3042.0,0.0,186M,Rated for 3+,1368.0,"Mar 30, 2019",,False,4.0098686,"['com.awp.stashaway', 'com.ifast.fsm', 'com.investingnote.investingnoteandroid', 'com.rubicoin.invest', 'com.cousant.naijainvest']",2.3.4
Remita,"View balances across all banks, send money, pay bills, monitor expenses and more",True,Finance,"100,000+",1454.0,0.0,25M,Rated for 3+,874.0,"Jul 26, 2017",,False,2.848276,"['com.ceva.firstmoniewallet', 'ai.kudi.agent', 'com.mypaga.customer', 'com.wemabank.alat.prod', 'com.quickteller.app']",1.10
Firstmonie Wallet,"Firstmonie wallet, quick and easy way to spend everyday",True,Finance,"100,000+",726.0,0.0,14M,Rated for 3+,410.0,"Dec 19, 2019",,False,3.82,"['com.mypaga.customer', 'com.wemabank.alat.prod', 'com.quickteller.app', 'ai.kudi.agent', 'com.lenddo.mobile.paylater']",1.40v
"9ja Cash-Loan App in Nigeria, Quick an Fast","Instant personal loan app, Online apply loan, Less info for get loan, Kredit",True,Finance,"1,000,000+",92209.0,0.0,6.5M,Rated for 3+,77110.0,"Jan 17, 2020",,False,4.777977,"['com.nigeria.soko', 'com.ng.ninecredit', 'com.loan.money.credit.nigeria.gocash', 'com.fastmoney.loan.credit.cash.nigeria', 'com.imoney.credit.nira']",1.1.2
FAST MONEY - Quick Online Loans APP in Nigeria,"Get a loan up to NGN 300,000 in nigeria with FAST MONEY.",True,Finance,"1,000,000+",54551.0,0.0,6.2M,Rated for 3+,48597.0,"Dec 9, 2020",,False,4.8565283,"['com.nigeria.soko', 'com.loan.money.credit.nigeria.gocash', 'com.pbank.newcredit', 'com.transsnetfinancial.palmcredit', 'ni.lcredit.money.cash']",1.0.2
GOCASH-Quick Online Loans APP in Nigeria,"Get a loan up to NGN 300,000 in nigeria with GOCASH. quick and fast loan app.",True,Finance,"1,000,000+",94455.0,0.0,6.5M,Rated for 3+,74726.0,"Sep 26, 2020",,False,4.7125864,"['com.nigeria.soko', 'com.loan.cash.credit.okash.nigeria', 'com.ng.ninecredit', 'com.imoney.credit.nira', 'com.fastmoney.loan.credit.cash.nigeria']",1.0.4
"LCredit-Loan Online & Cash, Anytime","LCredit Loan app Offers Instant Online Loan Anytime, Anywhere.",True,Finance,"1,000,000+",52676.0,0.0,11M,Rated for 3+,31041.0,"Nov 27, 2019",,False,4.180649,"['com.pbank.newcredit', 'com.loan.money.credit.nigeria.gocash', 'com.transsnetfinancial.palmcredit', 'com.fastmoney.loan.credit.cash.nigeria', 'com.nigeria.soko']",1.2.8
Newcredit-Personal and Instant Loan App in Nigeria,Reliable and Safe Loan Service App in Nigeria.Easy to Apply with Simple Steps.,True,Finance,"1,000,000+",26226.0,0.0,11M,Rated for 3+,12047.0,"Oct 17, 2020",,False,4.475693,"['ni.lcredit.money.cash', 'com.imoney.credit.nira', 'com.loan.money.credit.nigeria.gocash', 'com.fastmoney.loan.credit.cash.nigeria', 'com.nigeria.soko']",1.0.8
iMoney,Reliable loan in Nigeria,True,Finance,"500,000+",21876.0,0.0,7.4M,Rated for 3+,8119.0,"Jun 4, 2020",,False,4.347096,"['com.pbank.newcredit', 'com.nigeria.soko', 'com.loan.money.credit.nigeria.gocash', 'com.renmoney.android', 'com.loan.cash.credit.easycredit.nigeria']",1.2.4
"Renmoney: Loans, Savings, Fixed Deposit",High yield Fixed Deposits and convenient Personal and Micro-business Loans,True,Finance,"100,000+",4097.0,0.0,13M,Rated for 3+,2720.0,"Apr 12, 2020",,False,3.2281554,"['com.nigeria.soko', 'com.aella.comportal', 'com.imoney.credit.nira', 'com.transsnetfinancial.palmcredit', 'com.lenddo.mobile.paylater']",2.2.25
Palmcredit-Loan Online & Instant Cash Anytime,"Safe and reliable online loan app in Nigeria,get instant cash anytime.",True,Finance,"1,000,000+",127672.0,0.0,9.6M,Rated for 3+,68982.0,"Jun 26, 2018",,False,4.7821913,"['io.quickcheck.loans', 'com.nigeria.soko', 'com.lenddo.mobile.paylater', 'com.aella.comportal', 'com.loan.cash.credit.okash.nigeria']",2.7.1
Loan App for Instant Personal Loan - QuickCheck,"Quick Loans app in Nigeria. No collateral. Grow your business, face emergencies",True,Finance,"1,000,000+",111148.0,0.0,40M,Rated for 3+,72205.0,"Jul 5, 2016",,False,4.4791837,"['com.transsnetfinancial.palmcredit', 'com.nigeria.soko', 'com.loan.money.credit.nigeria.gocash', 'com.lenddo.mobile.paylater', 'com.pbank.newcredit']",6.0
"Carbon: instant loans, free digital banking","Get instant loans, invest money, and make payments - all in the Carbon app.",True,Finance,"1,000,000+",97448.0,0.0,27M,Rated for 3+,68557.0,"May 18, 2016",,False,4.173132,"['com.transsnetfinancial.palmcredit', 'com.aella.comportal', 'io.quickcheck.loans', 'com.loan.money.credit.nigeria.gocash', 'com.renmoney.android']",8.5.0
Arvofinance: Fast Unsecured Loans,Arvofinance is a solution that provides unsecured loans,True,Finance,"100,000+",5796.0,0.0,8.8M,Rated for 3+,3821.0,"May 6, 2019",,False,3.7615132,"['com.credpal.loan', 'com.renmoney.android', 'com.aella.comportal', 'com.ng.ninecredit', 'com.nigeria.soko']",4.2.4
ReadyCash for Agents,ReadyCash agents provide financial services to every Nigerian,True,Finance,"10,000+",451.0,0.0,8.4M,Rated for 3+,312.0,"Dec 7, 2018",,False,3.88,"['com.finch_agent_mobile_app', 'com.aella.comportal', 'com.imoney.credit.nira', 'com.renmoney.android', 'com.vanstone.vm20sdk']",0.5.31
"Aella App: Instant loans, bills payment and more",Quick and easy loans and bill payments solutions. Our 5mins is 5mins!,True,Finance,"1,000,000+",30606.0,0.0,5.9M,Rated for 3+,22409.0,"Oct 30, 2016",,False,3.304107,"['com.lenddo.mobile.paylater', 'com.renmoney.android', 'com.transsnetfinancial.palmcredit', 'com.imoney.credit.nira', 'com.nigeria.soko']",7.2.0
Newcredit-Personal and Instant Loan App in Nigeria,Reliable and Safe Loan Service App in Nigeria.Easy to Apply with Simple Steps.,True,Finance,"1,000,000+",26226.0,0.0,11M,Rated for 3+,12047.0,"Oct 17, 2020",,False,4.4755044,"['ni.lcredit.money.cash', 'com.imoney.credit.nira', 'com.loan.money.credit.nigeria.gocash', 'com.fastmoney.loan.credit.cash.nigeria', 'com.nigeria.soko']",1.0.8
"Branch- Free transfers, Instant loans & Investment","Enjoy unlimited free transfers, Instant loans & 20% ROI per annum on Investment",True,Finance,"10,000,000+",479305.0,0.0,7.3M,Rated for 3+,269575.0,"Mar 19, 2015",,False,4.496557,"['com.lenddo.mobile.paylater', 'com.renmoney.android', 'com.loan.money.credit.nigeria.gocash', 'com.imoney.credit.nira', 'com.transsnetfinancial.palmcredit']",4.6.0
"Busha: Buy & Sell Bitcoin, Ethereum. Crypto Wallet","Buy, Sell, Swap & Store Bitcoin, Ethereum, Litecoin & more instantly or via P2P!",True,Finance,"100,000+",2406.0,0.0,17M,Rated for 3+,1841.0,"Jan 21, 2019",,False,3.942857,"['com.roqqu.app', 'com.app.cryptofully', 'africa.bundle.mobile.app', 'com.paxful.wallet', 'lt.spectrofinance.spectrocoin.android.wallet']",2.6.14
"Bundle Africa - Send/Get Cash, Buy & Sell Bitcoin","Bundle Africa is a social payments app for Cash - NGN & Crypto - BNB, BTC & ETH",True,Finance,"100,000+",10474.0,0.0,49M,Rated for 12+,6443.0,"Apr 20, 2020",,False,4.422932,"['com.roqqu.app', 'co.busha.android', 'com.paxful.wallet', 'com.eversendapp', 'com.chippercash']",3.0.0
Roqqu: Buy & Sell Bitcoin and Cryptocurrency Fast,"Roqqu: The easiest way to buy, sell and securely store cryptocurrencies",True,Finance,"500,000+",16033.0,0.0,28M,Rated for 3+,11648.0,"Sep 30, 2019",,False,3.6734948,"['co.busha.android', 'africa.bundle.mobile.app', 'com.app.cryptofully', 'com.paxful.wallet', 'com.fluxpayment']",1.4.59
Quidax - Buy and Sell Bitcoin,Quidax makes it easy to buy/sell Bitcoin and other cryptos in 5 minutes or less,True,Finance,"100,000+",1947.0,0.0,53M,Rated for 3+,1505.0,"Oct 21, 2019",,False,3.045226,"['com.roqqu.app', 'co.busha.android', 'loadng.com.loadng', 'africa.bundle.mobile.app', 'com.app.cryptofully']",1.8.0
LoadNG: Sell Bitcoin in Nigeria Instantly,"Sell Bitcoin, Ethereum, Ltc, Bch, USDC in Nigeria for Cash Instantly on LoadNG",True,Business,"5,000+",194.0,0.0,13M,Rated for 3+,138.0,"May 2, 2020",,False,4.36,"['com.newgo.coincola', 'com.bitpezapro.app', 'com.cardtonic.app', 'lt.spectrofinance.spectrocoin.android.wallet', 'com.spantom.jeroid']",2.3.0
Rocket by Chiji14xchange - buy and sell crypto,Buy and Sell Bitcoin or USDT (Crypto) and Sell Gift Cards in Nigeria,True,Finance,"10,000+",986.0,0.0,30M,Rated for 3+,863.0,"Apr 22, 2019",,False,2.96,"['loadng.com.loadng', 'com.bitpezapro.app', 'com.cardtonic.app', 'com.gonglian.tbay', 'com.spantom.jeroid']",3.0.5
Bekonta: Buy & Sell BTC and Cryptocurrency Fast,"Bekonta enables you to Buy or Sell your BTC, ETH, BNB and more in seconds",True,Finance,"10,000+",102.0,0.0,3.0M,Rated for 3+,80.0,"Feb 9, 2020",,False,4.25,"['loadng.com.loadng', 'com.xrex.mobile', 'com.roqqu.app', 'co.busha.android', 'com.app.cryptofully']",1.0.3
Cryptofully,"Send, Receive and Convert Cryptocurrency To Naira",True,Finance,"5,000+",346.0,0.0,31M,Rated for 3+,136.0,"Oct 29, 2020",,False,4.059406,"['co.busha.android', 'com.fluxpayment', 'com.roqqu.app', 'africa.bundle.mobile.app', 'lt.spectrofinance.spectrocoin.android.wallet']",1.3.2
"Jackocoins -  Sell BTC, ETH, USDT in Nigeria","Sell Bitcoin, Ethereum and USDT for naira with velocity",True,Finance,"5,000+",131.0,0.0,6.5M,Rated for 3+,105.0,"Jul 18, 2020",,False,3.8442624,"['loadng.com.loadng', 'com.bitpezapro.app', 'com.newgo.coincola', 'lt.spectrofinance.spectrocoin.android.wallet', 'com.xrex.mobile']",1.1.15
CoinCola - Buy Bitcoin with Gift Cards,"Fast, easy and secure cryptocurrency trading. Buy and sell bitcoin instantly.",True,Finance,"50,000+",850.0,0.0,40M,Rated for 3+,371.0,"Jul 7, 2017",,False,4.081481500000001,"['lt.spectrofinance.spectrocoin.android.wallet', 'loadng.com.loadng', 'co.busha.android', 'com.bitrefill.app', 'com.zengo.wallet']",4.9.4
ABiTraderApp,"Use the ABiTraderApp to learn and trade BITCOIN, TATCOIN and other cryptos.",True,Finance,"10,000+",455.0,0.0,38M,Rated for 3+,264.0,"May 18, 2021",,False,4.09901,"['com.abit.abitcrowd', 'com.roqqu.app', 'com.app.cryptofully', 'co.busha.android', 'moneymie.bank.nigeria.remit.sendmoney']",2.5.1
AbokiFX,abokiFX provides you with daily naira FX rates.,True,Finance,"100,000+",445.0,0.0,9.7M,Rated for 3+,160.0,"Feb 3, 2017",True,False,4.22,"['com.greatcallie.abokiforex', 'moneymie.bank.nigeria.remit.sendmoney', 'com.cousant.naijainvest', 'com.ecocash.saremit.production', 'com.ifs.banking.fiid3605']",1.50
Moneymie: Bank for Migrants,The easiest way for migrants to send and receive money,True,Finance,"5,000+",163.0,0.0,34M,Rated for 3+,148.0,"Dec 3, 2020",,False,4.41844,"['ng.bytelabs.watu', 'com.mintfintech.app', 'com.ifs.banking.fiid3605', 'com.qsoft.aidapay', 'com.app.Abokifx']",1.1.46
OVERWOOD: SAFE INVESTMENTS FOR NIGERIANS,"Safe, high-yield investments for Africans",True,Finance,"1,000+",25.0,0.0,11M,Rated for 3+,18.0,"Apr 2, 2021",,False,4.84,"['com.unionbankng.marcusproject', 'com.cousant.naijainvest', 'com.kashbase.spark', 'newstocks.nigeria.nse', 'com.pettysave.app']",1.20.0
Hervest,Financial Services for Women,True,Finance,"1,000+",59.0,0.0,24M,Rated for 3+,33.0,"Feb 4, 2020",,False,4.118644000000001,"['com.farmcrowdyapp', 'com.pettysave.app', 'com.kashbase.spark', 'co.agropartnerships.android', 'com.vanstone.vm20sdk']",4.7.23
InvestaNigeria - Online Savings and Investment,InvestaNigeria  is a secure online savings & investment platform in Nigeria.,True,Finance,"1,000+",61.0,0.0,10M,Rated for 3+,56.0,"Jan 31, 2020",,False,4.2459016,"['co.agropartnerships.android', 'com.cousant.naijainvest', 'co.troveapp.android', 'com.rise.mobile', 'com.unionbankng.marcusproject']",11.0.0
Crowdyvest - Smarter way to get your Money working,Crowdyvest connects you to impact-driven opportunities with higher returns.,True,Finance,"50,000+",408.0,0.0,19M,Rated for 3+,278.0,"Nov 13, 2017",,False,3.71,"['com.hervest', 'co.agropartnerships.android', 'com.pettysave.app', 'com.rise.mobile', 'co.troveapp.android']",3.24.0
"Risevest: Save, Invest, and Earn Dollar Returns.",Risevest is the best investment app for inflation-beating dollar investments.,True,Finance,"100,000+",1050.0,0.0,12M,Rated for 3+,536.0,"Nov 2, 2019",,False,4.0185184000000005,"['com.cousant.naijainvest', 'ng.chaka.android', 'com.pettysave.app', 'co.troveapp.android', 'co.agropartnerships.android']",2.9.7
TrueSaver- ajo | esusu | adashe,"Save with a group of friends, collect group savings turn-by-turn",True,Finance,"1,000+",151.0,0.0,51M,Rated for 3+,143.0,"Jul 8, 2020",,False,4.79,"['com.hervest', 'com.kashbase.spark', 'com.farmcrowdyapp', 'com.pettysave.app', 'co.agropartnerships.android']",1.0.6
SumoTrust: Save & Invest Now,SumoTrust is secured digital saving and investment platform for Africans,True,Finance,"10,000+",230.0,0.0,9.5M,Rated for 3+,201.0,"Sep 4, 2019",,False,4.15,"['moneymie.bank.nigeria.remit.sendmoney', 'com.cousant.naijainvest', 'com.kashbase.spark', 'com.mintfintech.app', 'com.unionbankng.marcusproject']",1.1.6
Fundall - All things money in one place,"Save, invest, make online payments, get insurance, see spending insights & more.",True,Finance,"10,000+",305.0,0.0,15M,Rated for 3+,226.0,"Sep 1, 2019",,False,3.92,"['com.global.gomoney', 'com.aella.comportal', 'com.truesaver.truesaver', 'com.imoney.credit.nira', 'com.renmoney.android']",1.58
Payday link for MicroFinances,Simple app that locate nearby loan services for users.,True,Finance,"10,000+",41.0,0.0,6.5M,Rated for 3+,19.0,"Apr 24, 2020",True,False,4.365854,"['com.romerock.apps.utilities.moneylendingwizard', 'com.credpal.loan']",1.0
Wallets Africa - Seamless Digital Transactions,Transact across Africa. Spend anywhere in the world.,True,Finance,"50,000+",1769.0,0.0,17M,Rated for 3+,1410.0,"Jun 22, 2017",,False,3.4269662000000003,"['com.eversendapp', 'com.roqqu.app', 'africa.bundle.mobile.app', 'moneymie.bank.nigeria.remit.sendmoney', 'co.busha.android']",2.480
MyTAJ,MyTAJ Bank is here!,True,Finance,"50,000+",243.0,0.0,27M,Rated for 3+,125.0,"Oct 28, 2019",,False,4.48,"['com.stanbicibtc.mobile', 'com.qucoon.keystonemobilebankingapp', 'com.sc.breezenigeria.banking', 'com.ifs.banking.fiid3605', 'com.vanstone.vm20sdk']",1.5.0
"1app : 1app.ng, Cheap Data, Free Transfers, Loans","One app for all payments at the cheapest price. Airtime, Data, Loans, Investment",True,Finance,"50,000+",1183.0,0.0,39M,Rated for 3+,825.0,"Jun 9, 2020",,False,3.3166666,"['com.qsoft.aidapay', 'com.capricorn.baximobile.app', 'ng.verifyme.agent', 'app.vtpass.com', 'tingtel.android']",1.1.4
"Paymyrent - Save Daily, Weekly or Monthly","Save a little something, for your next house rent on Paymyrent.",True,Finance,"10,000+",178.0,0.0,11M,Rated for 3+,137.0,"Dec 19, 2019",,False,4.059406,"['com.overwood.overwood', 'com.kashbase.spark', 'com.hervest', 'com.unionbankng.marcusproject', 'com.pettysave.app']",1.6.0
CreditClub Offline,CreditClub app with offline functionality,True,Finance,"5,000+",40.0,0.0,2.7M,Rated for 3+,20.0,"Jul 25, 2016",,False,3.675,"['com.hervest', 'com.mintfintech.app', 'com.kashbase.spark', 'com.truesaver.truesaver', 'com.callphoneng.airvend']",1.3.4
CreditClub PLUS,Agent Banking App driving financial inclusion,True,Finance,"1,000+",52.0,0.0,27M,Rated for 3+,34.0,"Nov 2, 2018",,False,3.8461537,"['com.mintfintech.app', 'com.icom.kadick.mpos', 'com.global.gomoney', 'com.zenithbank.zenithagent', 'com.sc.s2b.ng.mobile']",1.4.1
Kiakia P2P,You fund. We lend. We invest. You earn.,True,Finance,"50,000+",188.0,0.0,14M,Rated for 3+,144.0,"May 21, 2020",,False,3.16,"['com.renmoney.android', 'com.aella.comportal', 'com.romerock.apps.utilities.moneylendingwizard', 'com.nigeria.soko', 'io.quickcheck.loans']",1.0.8
Bankly Agent,"Bankly is a digital product, that makes saving easy.",True,Finance,"10,000+",140.0,0.0,16M,Rated for 3+,92.0,"Nov 23, 2019",,False,3.51,"['com.ifs.banking.fiid3605', 'com.capricorn.baximobile.app', 'com.vanstone.vm20sdk', 'moneymie.bank.nigeria.remit.sendmoney', 'com.mintfintech.app']",1.0.276
BuyPower,Simplified payment for electricity in Nigeria. Spreading across Africa.,True,Finance,"100,000+",10691.0,0.0,Varies with device,Rated for 3+,6832.0,"Feb 14, 2017",True,False,4.334875,"['app.vtpass.com', 'com.nownow.android', 'com.tajbank.app', 'com.transsnet.palmpromoter', 'com.capricorn.baximobile.app']",Varies with device
PIDO Mobile Money App,"Pay Bills, Recharge Airtime & Transfer Money  From Your Phone.
Download PIDO Now",True,Finance,"10,000+",120.0,0.0,3.3M,Rated for 3+,45.0,"Jul 29, 2013",,False,3.6039605,"['com.qsoft.aidapay', 'moneymie.bank.nigeria.remit.sendmoney', 'com.eversendapp', 'com.mypaga.customer', 'com.quickteller.app']",3.2.11
Prospa - Business Account,Prospa - Your banking & business in one place,True,Finance,"50,000+",496.0,0.0,154M,Rated for 3+,308.0,"Mar 28, 2020",,False,4.514851599999999,"['com.capricorn.baximobile.app', 'com.obounce.oneapp1', 'com.daretoinnovate.oze', 'com.mintfintech.app', 'moneymie.bank.nigeria.remit.sendmoney']",1.2.7
Tingg,"Tingg is an easy, cashless and convenient payment solution",True,Finance,"10,000+",186.0,0.0,7.8M,Rated for 3+,123.0,"Mar 22, 2019",,False,3.28,"['com.kashbase.spark', 'ng.bytelabs.watu', 'com.callphoneng.airvend', 'com.icom.kadick.mpos', 'com.pettysave.app']",2.0
Hometown,Get instant loan. Save. Invest. Manage your Finance. Spend,True,Finance,"10,000+",797.0,0.0,14M,Rated for 3+,630.0,"May 5, 2020",,False,3.2871287,"['com.aella.comportal', 'com.renmoney.android', 'com.imoney.credit.nira', 'com.qsoft.aidapay', 'com.ng.ninecredit']",1.1.0
Palmsaveâ€”Saving and Earning,Making money is always hardï¼Œbut Palmsave makes deposits easy and secureï¼ï¼,True,Finance,"10,000+",669.0,0.0,4.1M,Rated for 3+,299.0,"Aug 6, 2018",,False,5.0,"['loadng.com.loadng', 'com.sagoon.connect.share.earn', 'network.celsius.wallet', 'com.zengo.wallet', 'com.socialgood_foundation.sg_app_android']",2.0.2
Payvice,"Purchase airtime, settle utility bills and pay for subscriptions with Payvice.",True,Finance,"10,000+",432.0,0.0,23M,Rated for 3+,284.0,"Jun 17, 2016",,False,4.13,"['com.shago', 'com.vanstone.vm20sdk', 'com.capricorn.baximobile.app', 'moneymie.bank.nigeria.remit.sendmoney', 'ai.kudi.agent']",3.3.0
"m-naira App - Send, Receive, Pay  Cash Instantly","m-naira App - Send, pay, receive, spend, save, and invest cash Instantly",True,Finance,"10,000+",123.0,0.0,6.5M,Rated for 3+,77.0,"Apr 4, 2019",,False,3.38,"['com.quickteller.app', 'moneymie.bank.nigeria.remit.sendmoney', 'com.aella.comportal', 'com.finch_agent_mobile_app', 'com.mypaga.customer']",3.1
First Registrars Mobile,First Registrars Mobile,True,Finance,"10,000+",75.0,0.0,16M,Rated for 3+,48.0,"Mar 26, 2018",,False,3.16,"['the.family.alter', 'com.talentbox.afcquarterly', 'com.alcaldebibliapps.desire.ages.adventist', 'com.microsoft.azure.mobileapps.hymobile', 'com.pledge51.nigerianconstitution']",2.0.3
MyAXA,Experience MyAXA Mobile App for one stop non-banking financial services,True,Finance,"10,000+",132.0,0.0,13M,Rated for 3+,73.0,"Jul 26, 2017",,False,3.15,"['com.microsoft.azure.mobileapps.hymobile', 'com.overwood.overwood', 'com.afexnigeria.comx', 'com.ifs.banking.fiid3605', 'moneymie.bank.nigeria.remit.sendmoney']",1.3.0.0
Social Lender,Micro-credit Based On Social Reputation,True,Finance,"10,000+",87.0,0.0,24M,Rated for 12+,64.0,"Jan 31, 2019",,False,3.183908,"['com.truesaver.truesaver', 'com.icom.kadick.mpos', 'moneymie.bank.nigeria.remit.sendmoney', 'com.callphoneng.airvend', 'com.munawallet.muna']",1.3.0
Social Lender,Micro-credit Based On Social Reputation,True,Finance,"10,000+",87.0,0.0,24M,Rated for 12+,64.0,"Jan 31, 2019",,False,3.183908,"['com.truesaver.truesaver', 'com.icom.kadick.mpos', 'moneymie.bank.nigeria.remit.sendmoney', 'com.callphoneng.airvend', 'com.munawallet.muna']",1.3.0
Yochaa - Nigerian Stocks,"Analyse, understand and invest in the Nigerian Stock Market",True,Finance,"10,000+",158.0,0.0,Varies with device,Rated for 3+,102.0,"Nov 20, 2016",True,False,4.45,"['co.troveapp.android', 'com.cousant.naijainvest', 'com.unionbankng.marcusproject', 'co.agropartnerships.android', 'newstocks.nigeria.nse']",Varies with device
Bekonta: Buy & Sell BTC and Cryptocurrency Fast,"Bekonta enables you to Buy or Sell your BTC, ETH, BNB and more in seconds",True,Finance,"10,000+",102.0,0.0,3.0M,Rated for 3+,80.0,"Feb 9, 2020",,False,4.25,"['loadng.com.loadng', 'com.xrex.mobile', 'com.roqqu.app', 'co.busha.android', 'com.app.cryptofully']",1.0.3
SureRemit,Global Non-Cash Remittance platform,True,Finance,"5,000+",90.0,0.0,28M,Rated for 3+,44.0,"Jun 22, 2016",,False,4.4222220000000005,"['com.talkremit.android', 'com.paperkite.orbitremit', 'com.afriex.afriex', 'com.brastelremit', 'com.companyname.riddha.moneyfexmobile']",3.0.2
BTCNaira,"Realtime Bitcoin and Ethereum Price to Naira, US Dollars, Pounds and Euro.",True,Finance,"10,000+",44.0,0.0,16M,Rated for 3+,28.0,"Apr 17, 2017",True,False,4.1363635,"['com.app.cryptofully', 'com.roqqu.app', 'co.busha.android', 'com.spantom.jeroid', 'moneymie.bank.nigeria.remit.sendmoney']",1.3
Abegâ€Šâ€”â€ŠSocial payments,Make Someone Happy With Cash,True,Finance,"500,000+",3770.0,0.0,45M,Rated for 3+,2241.0,"Sep 4, 2020",,False,4.014344,"['team.opay.pay', 'com.kudabank.app', 'com.chippercash', 'com.transsnet.palmpay', 'com.wemabank.alat.prod']",3.0.8
Swapix Nigeria: sell and buy online easy and fast!,"New & used cars, houses, smartphones and more. Sell and buy with Swapix Nigeria!",True,Shopping,"100,000+",2610.0,0.0,13M,Rated for 3+,1601.0,"Jul 24, 2018",True,False,3.8965516,"['com.kentae.market', 'com.opera.olist', 'com.listmaga.app', 'com.nipek.cdcare', 'com.nigeriapropertycentre.app']",3.3.31
CDcare,CDcare Marketplace lets Africans buy  appliances & pay in installments.,True,Shopping,"50,000+",229.0,0.0,11M,Rated for 3+,136.0,"Jan 29, 2020",,False,3.910891,"['com.kongapay.android', 'co.tradedepot.shop', 'com.opera.olist', 'com.mm.foreignmarket', 'com.kentae.market']",1.1.11
Mintyn - Digital Banking App,Donâ€™t just own a Bank Account. Own your MINTYN. Your Bank. Your Rules.,True,Finance,"100,000+",728.0,0.0,31M,Rated for 3+,403.0,"Jun 9, 2020",,False,3.2358491000000003,"['moneymie.bank.nigeria.remit.sendmoney', 'com.kashbase.spark', 'com.ifs.banking.fiid3605', 'com.capricorn.baximobile.app', 'com.vanstone.vm20sdk']",1.0.0
StashBox:  Save. Invest. Earn.,"StashBox App allows users save, invest and earn.",True,Finance,"5,000+",55.0,0.0,12M,Rated for 3+,36.0,"Jan 18, 2021",,False,3.7818182,"['com.pettysave.app', 'com.farmcrowdyapp', 'com.baraka.app', 'co.agropartnerships.android', 'com.kashbase.spark']",1.2
MicMac Cooperative Apps,MicMac Cooperative Apps,True,Finance,"5,000+",58.0,0.0,64M,Rated for 3+,29.0,"Mar 2, 2020",,False,4.068965400000001,"['com.kashbase.spark', 'moneymie.bank.nigeria.remit.sendmoney', 'com.truesaver.truesaver', 'ng.bytelabs.watu', 'com.vanstone.vm20sdk']",1.12
Jetseed (ex-Pettysave) - Save and invest online,"Safe, Smart Money",True,Finance,"10,000+",293.0,0.0,10M,Rated for 3+,160.0,"Jan 17, 2020",,False,3.99,"['com.hervest', 'com.kashbase.spark', 'com.rise.mobile', 'com.farmcrowdyapp', 'com.unionbankng.marcusproject']",2.1.0
KADTAX,Kaduna Tax Mobile App,True,Finance,10+,,0.0,4.1M,Rated for 3+,0.0,"Sep 27, 2017",,False,0.0,"['azan.nigeria.prayer.time', 'com.radiolight.nigeria', 'com.appmind.radios.ng', 'com.hititcs.arikair', 'com.siddigital_.nrc']",0.0.4
Arena Financials,Arena Financials helps individuals to send money to friends & family in Nigeria,True,Finance,10+,,0.0,27M,Rated for 3+,0.0,"Aug 29, 2020",,False,0.0,"['com.finch_agent_mobile_app', 'com.vanstone.vm20sdk', 'com.quickteller.app', 'com.prospa', 'com.shago']",1.0
"LAMMAPAI - Buy & Sell Or Borrow Airtime , and Data","You can Buy or Sell Airtime To real cash or buy Data, Tv cable ,  Up to 10% OFF",True,Business,100+,11.0,0.0,10M,Rated for 12+,9.0,"Jun 3, 2021",,False,4.090909,"['moneymie.bank.nigeria.remit.sendmoney', 'com.icom.kadick.mpos', 'com.tranzfar', 'com.simbapay.simbapayandroid', 'com.qsoft.aidapay']",V12
Sb Communications,SB communications is a digital payment app for the underbanked Nigerian market.,True,Finance,50+,,0.0,7.2M,Rated for 3+,0.0,"Oct 23, 2020",,False,0.0,"['com.finch_agent_mobile_app', 'moneymie.bank.nigeria.remit.sendmoney', 'com.vanstone.vm20sdk', 'ai.kudi.agent', 'com.capricorn.baximobile.app']",1.0.11
Nigeria Car Insurance : Nigeria Health Insurance,Nigeria car Life Vehicle Insurance Company List,True,Finance,10+,,0.0,6.5M,Rated for 3+,0.0,"Aug 5, 2020",True,False,0.0,"['com.lemonadeFinance.android', 'com.washingtionfederal.finance', 'co.tradedepot.shop', 'com.shago']",1.0
MarinEso,We buy Gift Cards and Bitcoins.,True,Finance,10+,,0.0,22M,Rated for 3+,0.0,"Jun 12, 2020",,False,0.0,"['com.suregifts.sureremit', 'moneymie.bank.nigeria.remit.sendmoney', 'com.eversendapp', 'com.simbapay.simbapayandroid', 'com.payqin']",1.0
